[Wed Apr 22 01:35:33 AM CEST 2026] Job started on ly-w113
SLURM_JOB_ID=795625
PROJECT_DIR=/globalsc/users/b/a/baffetti/research/TransfomerROM
ENTRYPOINT=Baseline_hpo.py
Activating environment: /globalsc/ulb/atm/baffetti/envs/artfire_new/bin/activate
/globalsc/users/b/a/baffetti/envs/artfire_new/bin/python
/globalsc/users/b/a/baffetti/envs/artfire_new/bin/pip
Python 3.11.3
Wed Apr 22 01:35:33 2026       
+-----------------------------------------------------------------------------------------+
| NVIDIA-SMI 570.124.06             Driver Version: 570.124.06     CUDA Version: 12.8     |
|-----------------------------------------+------------------------+----------------------+
| GPU  Name                 Persistence-M | Bus-Id          Disp.A | Volatile Uncorr. ECC |
| Fan  Temp   Perf          Pwr:Usage/Cap |           Memory-Usage | GPU-Util  Compute M. |
|                                         |                        |               MIG M. |
|=========================================+========================+======================|
|   0  NVIDIA RTX 6000 Ada Gene...    On  |   00000000:01:00.0 Off |                  Off |
| 30%   38C    P8             26W /  300W |       2MiB /  49140MiB |      0%      Default |
|                                         |                        |                  N/A |
+-----------------------------------------+------------------------+----------------------+
                                                                                         
+-----------------------------------------------------------------------------------------+
| Processes:                                                                              |
|  GPU   GI   CI              PID   Type   Process name                        GPU Memory |
|        ID   ID                                                               Usage      |
|=========================================================================================|
|  No running processes found                                                             |
+-----------------------------------------------------------------------------------------+
Python usato:
/globalsc/users/b/a/baffetti/envs/artfire_new/bin/python
/globalsc/users/b/a/baffetti/envs/artfire_new/bin/python
Torch test:
2.5.0+cu124
[I 2026-04-22 03:16:14,265] Trial 1 finished with value: 0.0025060923165968947 and parameters: {'lr': 0.0001025350969016849, 'weight_decay': 0.006351221010640704, 'optimizer': 'adamw', 'use_lookahead': True, 'gradient_clip': 1.0, 'batch_size': 2, 'scheduler_power': 1, 'warmup_steps': 3, 'min_lr_ratio': 0.1590786990501735, 'modes1': 20, 'modes2': 20, 'width': 16, 'n_layers': 5, 'use_residual': True}. Best is trial 0 with value: 0.0025060923165968947.
[I 2026-04-22 05:11:20,095] Trial 3 finished with value: 0.12271413225177172 and parameters: {'lr': 0.003639264345367793, 'weight_decay': 0.007286653737491046, 'optimizer': 'adamw', 'use_lookahead': False, 'gradient_clip': 3.0, 'batch_size': 1, 'scheduler_power': 2, 'warmup_steps': 11, 'min_lr_ratio': 0.10057868320750825, 'modes1': 8, 'modes2': 12, 'width': 64, 'n_layers': 3, 'use_residual': False}. Best is trial 0 with value: 0.0025060923165968947.
[I 2026-04-22 07:14:27,897] Trial 5 finished with value: 0.01883457147994557 and parameters: {'lr': 2.4007683448156354e-05, 'weight_decay': 0.0016172900811143157, 'optimizer': 'adam', 'use_lookahead': True, 'gradient_clip': 1.0, 'batch_size': 1, 'scheduler_power': 3, 'warmup_steps': 13, 'min_lr_ratio': 0.1721400321777981, 'modes1': 20, 'modes2': 12, 'width': 48, 'n_layers': 4, 'use_residual': True}. Best is trial 0 with value: 0.0025060923165968947.
[I 2026-04-22 08:15:01,288] Trial 6 finished with value: 0.008663728324746763 and parameters: {'lr': 1.9552204240237687e-05, 'weight_decay': 1.3357240411974112e-06, 'optimizer': 'adamw', 'use_lookahead': False, 'gradient_clip': 3.0, 'batch_size': 8, 'scheduler_power': 3, 'warmup_steps': 13, 'min_lr_ratio': 0.4370156891919817, 'modes1': 16, 'modes2': 12, 'width': 48, 'n_layers': 4, 'use_residual': True}. Best is trial 0 with value: 0.0025060923165968947.
[I 2026-04-22 10:23:22,632] Trial 7 finished with value: 0.016236690021547918 and parameters: {'lr': 2.106265096461375e-05, 'weight_decay': 2.2410971619109514e-05, 'optimizer': 'adamw', 'use_lookahead': False, 'gradient_clip': 1.0, 'batch_size': 1, 'scheduler_power': 2, 'warmup_steps': 10, 'min_lr_ratio': 0.035224588112494785, 'modes1': 12, 'modes2': 12, 'width': 16, 'n_layers': 5, 'use_residual': True}. Best is trial 0 with value: 0.0025060923165968947.
[I 2026-04-22 11:16:25,183] Trial 8 finished with value: 0.09657226426375878 and parameters: {'lr': 0.0017966206213495693, 'weight_decay': 1.91920011015619e-05, 'optimizer': 'adamw', 'use_lookahead': False, 'gradient_clip': 5.0, 'batch_size': 8, 'scheduler_power': 1, 'warmup_steps': 7, 'min_lr_ratio': 0.06560202540788865, 'modes1': 8, 'modes2': 8, 'width': 32, 'n_layers': 3, 'use_residual': False}. Best is trial 0 with value: 0.0025060923165968947.
[I 2026-04-22 12:15:53,592] Trial 9 finished with value: 0.13874255088535514 and parameters: {'lr': 0.0024786753644700068, 'weight_decay': 0.0013167465326936148, 'optimizer': 'adamw', 'use_lookahead': False, 'gradient_clip': 5.0, 'batch_size': 8, 'scheduler_power': 2, 'warmup_steps': 4, 'min_lr_ratio': 0.3589678184602926, 'modes1': 16, 'modes2': 8, 'width': 48, 'n_layers': 6, 'use_residual': False}. Best is trial 0 with value: 0.0025060923165968947.
[I 2026-04-22 14:36:19,585] Trial 10 finished with value: 0.03839267942349653 and parameters: {'lr': 0.00022730157099266657, 'weight_decay': 0.00020305586522289154, 'optimizer': 'adamw', 'use_lookahead': True, 'gradient_clip': 5.0, 'batch_size': 1, 'scheduler_power': 3, 'warmup_steps': 8, 'min_lr_ratio': 0.4836608613313981, 'modes1': 8, 'modes2': 8, 'width': 16, 'n_layers': 6, 'use_residual': False}. Best is trial 0 with value: 0.0025060923165968947.
[I 2026-04-22 16:30:58,807] Trial 11 finished with value: 0.0002379887701150634 and parameters: {'lr': 0.00018039162099046078, 'weight_decay': 0.0009297973514956295, 'optimizer': 'adamw', 'use_lookahead': True, 'gradient_clip': 5.0, 'batch_size': 1, 'scheduler_power': 1, 'warmup_steps': 2, 'min_lr_ratio': 0.39323750827179527, 'modes1': 8, 'modes2': 20, 'width': 64, 'n_layers': 4, 'use_residual': True}. Best is trial 11 with value: 0.0002379887701150634.
[I 2026-04-22 18:23:25,937] Trial 12 finished with value: 0.0006643887483388991 and parameters: {'lr': 5.277977669226636e-05, 'weight_decay': 5.306252178059867e-05, 'optimizer': 'adamw', 'use_lookahead': True, 'gradient_clip': 1.0, 'batch_size': 1, 'scheduler_power': 1, 'warmup_steps': 1, 'min_lr_ratio': 0.32899624248819953, 'modes1': 8, 'modes2': 20, 'width': 64, 'n_layers': 4, 'use_residual': True}. Best is trial 11 with value: 0.0002379887701150634.
[I 2026-04-22 20:31:06,315] Trial 13 finished with value: 0.000427295477522814 and parameters: {'lr': 7.409587155348505e-05, 'weight_decay': 3.0678747819146654e-05, 'optimizer': 'adamw', 'use_lookahead': True, 'gradient_clip': 1.0, 'batch_size': 1, 'scheduler_power': 1, 'warmup_steps': 10, 'min_lr_ratio': 0.2682944812402289, 'modes1': 8, 'modes2': 20, 'width': 64, 'n_layers': 5, 'use_residual': True}. Best is trial 11 with value: 0.0002379887701150634.
[I 2026-04-22 21:01:44,440] Trial 14 pruned. 
