[Wed Apr 22 06:00:32 AM CEST 2026] Job started on ly-w117
SLURM_JOB_ID=795627
PROJECT_DIR=/globalsc/users/b/a/baffetti/research/TransfomerROM
ENTRYPOINT=Baseline_hpo.py
Activating environment: /globalsc/ulb/atm/baffetti/envs/artfire_new/bin/activate
/globalsc/users/b/a/baffetti/envs/artfire_new/bin/python
/globalsc/users/b/a/baffetti/envs/artfire_new/bin/pip
Python 3.11.3
Wed Apr 22 06:00:32 2026       
+-----------------------------------------------------------------------------------------+
| NVIDIA-SMI 570.124.06             Driver Version: 570.124.06     CUDA Version: 12.8     |
|-----------------------------------------+------------------------+----------------------+
| GPU  Name                 Persistence-M | Bus-Id          Disp.A | Volatile Uncorr. ECC |
| Fan  Temp   Perf          Pwr:Usage/Cap |           Memory-Usage | GPU-Util  Compute M. |
|                                         |                        |               MIG M. |
|=========================================+========================+======================|
|   0  NVIDIA RTX 6000 Ada Gene...    On  |   00000000:01:00.0 Off |                  Off |
| 30%   41C    P8             22W /  300W |       2MiB /  49140MiB |      0%      Default |
|                                         |                        |                  N/A |
+-----------------------------------------+------------------------+----------------------+
                                                                                         
+-----------------------------------------------------------------------------------------+
| Processes:                                                                              |
|  GPU   GI   CI              PID   Type   Process name                        GPU Memory |
|        ID   ID                                                               Usage      |
|=========================================================================================|
|  No running processes found                                                             |
+-----------------------------------------------------------------------------------------+
Python usato:
/globalsc/users/b/a/baffetti/envs/artfire_new/bin/python
/globalsc/users/b/a/baffetti/envs/artfire_new/bin/python
Torch test:
2.5.0+cu124
[I 2026-04-22 07:16:07,779] Trial 0 finished with value: 0.017154118927145325 and parameters: {'lr': 0.0001025350969016849, 'weight_decay': 0.006351221010640704, 'optimizer': 'adamw', 'use_lookahead': True, 'gradient_clip': 1.0, 'batch_size': 2, 'scheduler_power': 1, 'warmup_steps': 3, 'min_lr_ratio': 0.1590786990501735, 'base_channels': 64, 'use_residual': False}. Best is trial 0 with value: 0.017154118927145325.
[I 2026-04-22 08:31:08,553] Trial 1 finished with value: 0.01452375616676904 and parameters: {'lr': 9.745399020374078e-05, 'weight_decay': 6.672367170464208e-05, 'optimizer': 'adamw', 'use_lookahead': False, 'gradient_clip': 1.0, 'batch_size': 2, 'scheduler_power': 1, 'warmup_steps': 14, 'min_lr_ratio': 0.22567472193240465, 'base_channels': 64, 'use_residual': False}. Best is trial 1 with value: 0.01452375616676904.
[I 2026-04-22 09:23:28,203] Trial 2 finished with value: 0.0511036034975503 and parameters: {'lr': 6.939031266619747e-05, 'weight_decay': 0.00012030178871154674, 'optimizer': 'adamw', 'use_lookahead': True, 'gradient_clip': -1.0, 'batch_size': 8, 'scheduler_power': 2, 'warmup_steps': 5, 'min_lr_ratio': 0.4160813794844454, 'base_channels': 48, 'use_residual': True}. Best is trial 1 with value: 0.01452375616676904.
[I 2026-04-22 10:36:17,913] Trial 3 finished with value: 0.010755100121369232 and parameters: {'lr': 0.004608697883952073, 'weight_decay': 0.001227380098785297, 'optimizer': 'adamw', 'use_lookahead': True, 'gradient_clip': 1.0, 'batch_size': 2, 'scheduler_power': 1, 'warmup_steps': 6, 'min_lr_ratio': 0.16933982779310605, 'base_channels': 48, 'use_residual': False}. Best is trial 3 with value: 0.010755100121369232.
[I 2026-04-22 11:38:17,613] Trial 4 finished with value: 0.007581984981693126 and parameters: {'lr': 0.0011306704080979888, 'weight_decay': 0.0001758364027000851, 'optimizer': 'adamw', 'use_lookahead': True, 'gradient_clip': 5.0, 'batch_size': 4, 'scheduler_power': 2, 'warmup_steps': 15, 'min_lr_ratio': 0.122111101090895, 'base_channels': 64, 'use_residual': True}. Best is trial 4 with value: 0.007581984981693126.
[I 2026-04-22 12:39:21,188] Trial 5 finished with value: 241.20009567673142 and parameters: {'lr': 0.0022492927989859177, 'weight_decay': 0.0016394127471631608, 'optimizer': 'adam', 'use_lookahead': False, 'gradient_clip': -1.0, 'batch_size': 4, 'scheduler_power': 2, 'warmup_steps': 8, 'min_lr_ratio': 0.11883282713065782, 'base_channels': 48, 'use_residual': False}. Best is trial 4 with value: 0.007581984981693126.
[I 2026-04-22 13:40:02,847] Trial 6 finished with value: 0.010041041002684348 and parameters: {'lr': 9.581320979450773e-05, 'weight_decay': 0.007711312991331112, 'optimizer': 'adamw', 'use_lookahead': True, 'gradient_clip': 3.0, 'batch_size': 4, 'scheduler_power': 1, 'warmup_steps': 10, 'min_lr_ratio': 0.4929687225141943, 'base_channels': 48, 'use_residual': True}. Best is trial 4 with value: 0.007581984981693126.
[I 2026-04-22 14:31:42,595] Trial 7 finished with value: 0.048711260468573186 and parameters: {'lr': 0.0005088320637823439, 'weight_decay': 0.0003420730367009227, 'optimizer': 'adamw', 'use_lookahead': True, 'gradient_clip': 5.0, 'batch_size': 8, 'scheduler_power': 1, 'warmup_steps': 14, 'min_lr_ratio': 0.19950031968726334, 'base_channels': 16, 'use_residual': True}. Best is trial 4 with value: 0.007581984981693126.
[I 2026-04-22 15:23:11,079] Trial 8 finished with value: 9.934051570376834 and parameters: {'lr': 4.967944278666239e-05, 'weight_decay': 0.00043645169468077945, 'optimizer': 'adamw', 'use_lookahead': True, 'gradient_clip': 3.0, 'batch_size': 8, 'scheduler_power': 3, 'warmup_steps': 16, 'min_lr_ratio': 0.324595506615601, 'base_channels': 48, 'use_residual': False}. Best is trial 4 with value: 0.007581984981693126.
[I 2026-04-22 16:23:08,201] Trial 9 finished with value: 0.009189332618906691 and parameters: {'lr': 0.000617691140953651, 'weight_decay': 1.0477226564098284e-06, 'optimizer': 'adam', 'use_lookahead': True, 'gradient_clip': 1.0, 'batch_size': 4, 'scheduler_power': 2, 'warmup_steps': 1, 'min_lr_ratio': 0.19018074349912242, 'base_channels': 48, 'use_residual': True}. Best is trial 4 with value: 0.007581984981693126.
[I 2026-04-22 17:24:54,655] Trial 10 finished with value: 0.0009712135661519259 and parameters: {'lr': 0.003491096030337895, 'weight_decay': 0.0005724341889174792, 'optimizer': 'adamw', 'use_lookahead': False, 'gradient_clip': 5.0, 'batch_size': 4, 'scheduler_power': 3, 'warmup_steps': 8, 'min_lr_ratio': 0.0464815219112705, 'base_channels': 64, 'use_residual': True}. Best is trial 10 with value: 0.0009712135661519259.
[I 2026-04-22 18:25:07,220] Trial 11 finished with value: 0.015947953732432546 and parameters: {'lr': 0.004585783332158841, 'weight_decay': 0.0006727338698282257, 'optimizer': 'adamw', 'use_lookahead': False, 'gradient_clip': 5.0, 'batch_size': 4, 'scheduler_power': 3, 'warmup_steps': 10, 'min_lr_ratio': 0.04617124628903002, 'base_channels': 64, 'use_residual': False}. Best is trial 10 with value: 0.0009712135661519259.
[I 2026-04-22 19:24:54,247] Trial 12 finished with value: 0.0018868592215349545 and parameters: {'lr': 0.002908588699329934, 'weight_decay': 0.0001172957015251902, 'optimizer': 'adamw', 'use_lookahead': True, 'gradient_clip': 5.0, 'batch_size': 4, 'scheduler_power': 2, 'warmup_steps': 16, 'min_lr_ratio': 0.17268135207808027, 'base_channels': 64, 'use_residual': True}. Best is trial 10 with value: 0.0009712135661519259.
[I 2026-04-22 20:26:10,417] Trial 13 finished with value: 0.005700668491221763 and parameters: {'lr': 0.0002530270263641643, 'weight_decay': 0.001362512716760809, 'optimizer': 'adamw', 'use_lookahead': False, 'gradient_clip': -1.0, 'batch_size': 4, 'scheduler_power': 3, 'warmup_steps': 7, 'min_lr_ratio': 0.10342984052699998, 'base_channels': 64, 'use_residual': True}. Best is trial 10 with value: 0.0009712135661519259.
[I 2026-04-22 20:45:44,626] Trial 14 pruned. 
[I 2026-04-22 22:00:09,307] Trial 15 pruned. 
[I 2026-04-22 23:47:07,641] Trial 16 finished with value: 0.01530031893855414 and parameters: {'lr': 0.0026237586807770106, 'weight_decay': 1.554942280928468e-05, 'optimizer': 'adamw', 'use_lookahead': True, 'gradient_clip': 3.0, 'batch_size': 1, 'scheduler_power': 3, 'warmup_steps': 8, 'min_lr_ratio': 0.02502139430749268, 'base_channels': 64, 'use_residual': True}. Best is trial 10 with value: 0.0009712135661519259.
[I 2026-04-23 00:04:35,143] Trial 17 pruned. 
[I 2026-04-23 01:03:45,543] Trial 18 finished with value: 0.003255357053382574 and parameters: {'lr': 0.0004267950868794586, 'weight_decay': 0.0009084358698171938, 'optimizer': 'adamw', 'use_lookahead': False, 'gradient_clip': 5.0, 'batch_size': 4, 'scheduler_power': 3, 'warmup_steps': 17, 'min_lr_ratio': 0.09496455570320322, 'base_channels': 48, 'use_residual': True}. Best is trial 10 with value: 0.0009712135661519259.
