[Tue Apr 21 07:10:01 PM CEST 2026] Job started on ly-w205
SLURM_JOB_ID=795469
PROJECT_DIR=/globalsc/users/b/a/baffetti/research/TransfomerROM
ENTRYPOINT=Baseline_hpo.py
Activating environment: /globalsc/ulb/atm/baffetti/envs/artfire_new/bin/activate
/globalsc/users/b/a/baffetti/envs/artfire_new/bin/python
/globalsc/users/b/a/baffetti/envs/artfire_new/bin/pip
Python 3.11.3
Tue Apr 21 19:10:01 2026       
+-----------------------------------------------------------------------------------------+
| NVIDIA-SMI 570.124.06             Driver Version: 570.124.06     CUDA Version: 12.8     |
|-----------------------------------------+------------------------+----------------------+
| GPU  Name                 Persistence-M | Bus-Id          Disp.A | Volatile Uncorr. ECC |
| Fan  Temp   Perf          Pwr:Usage/Cap |           Memory-Usage | GPU-Util  Compute M. |
|                                         |                        |               MIG M. |
|=========================================+========================+======================|
|   0  NVIDIA RTX 6000 Ada Gene...    On  |   00000000:01:00.0 Off |                  Off |
| 30%   40C    P8             29W /  300W |       2MiB /  49140MiB |      0%      Default |
|                                         |                        |                  N/A |
+-----------------------------------------+------------------------+----------------------+
                                                                                         
+-----------------------------------------------------------------------------------------+
| Processes:                                                                              |
|  GPU   GI   CI              PID   Type   Process name                        GPU Memory |
|        ID   ID                                                               Usage      |
|=========================================================================================|
|  No running processes found                                                             |
+-----------------------------------------------------------------------------------------+
Python usato:
/globalsc/users/b/a/baffetti/envs/artfire_new/bin/python
/globalsc/users/b/a/baffetti/envs/artfire_new/bin/python
Torch test:
2.5.0+cu124
[I 2026-04-21 20:01:24,595] Trial 1 finished with value: 0.002602524765943353 and parameters: {'lr': 0.0001025350969016849, 'weight_decay': 0.006351221010640704, 'optimizer': 'adamw', 'use_lookahead': True, 'gradient_clip': 1.0, 'batch_size': 2, 'scheduler_power': 1, 'warmup_steps': 3, 'min_lr_ratio': 0.1590786990501735, 'modes1': 10, 'modes2': 10, 'modes3': 4, 'width': 32, 'n_layers': 6}. Best is trial 1 with value: 0.002602524765943353.
[I 2026-04-21 20:57:17,881] Trial 2 finished with value: 0.0034275919280795228 and parameters: {'lr': 0.0015199881220083974, 'weight_decay': 1.6536937182824424e-05, 'optimizer': 'adam', 'use_lookahead': True, 'gradient_clip': 3.0, 'batch_size': 1, 'scheduler_power': 1, 'warmup_steps': 20, 'min_lr_ratio': 0.38981508344694615, 'modes1': 4, 'modes2': 10, 'modes3': 8, 'width': 24, 'n_layers': 6}. Best is trial 1 with value: 0.002602524765943353.
[I 2026-04-21 21:54:34,919] Trial 3 finished with value: 0.0020278881319697848 and parameters: {'lr': 0.0012141307774357361, 'weight_decay': 6.235377135673162e-06, 'optimizer': 'adam', 'use_lookahead': False, 'gradient_clip': -1.0, 'batch_size': 1, 'scheduler_power': 1, 'warmup_steps': 6, 'min_lr_ratio': 0.3675070273856514, 'modes1': 6, 'modes2': 10, 'modes3': 6, 'width': 20, 'n_layers': 6}. Best is trial 3 with value: 0.0020278881319697848.
[I 2026-04-21 22:39:23,126] Trial 4 finished with value: 0.10012217727867333 and parameters: {'lr': 4.707954411452835e-05, 'weight_decay': 4.3805807679056575e-05, 'optimizer': 'adamw', 'use_lookahead': False, 'gradient_clip': 1.0, 'batch_size': 8, 'scheduler_power': 2, 'warmup_steps': 16, 'min_lr_ratio': 0.44908473696251167, 'modes1': 10, 'modes2': 6, 'modes3': 4, 'width': 12, 'n_layers': 6}. Best is trial 3 with value: 0.0020278881319697848.
[I 2026-04-21 23:38:58,298] Trial 5 finished with value: 0.0009701725413292848 and parameters: {'lr': 0.003959281492292679, 'weight_decay': 1.0165510266418738e-05, 'optimizer': 'adamw', 'use_lookahead': True, 'gradient_clip': -1.0, 'batch_size': 1, 'scheduler_power': 3, 'warmup_steps': 5, 'min_lr_ratio': 0.3393464182288805, 'modes1': 4, 'modes2': 6, 'modes3': 4, 'width': 16, 'n_layers': 5}. Best is trial 5 with value: 0.0009701725413292848.
