[Sat Apr 25 06:53:48 AM CEST 2026] Job started on ly-w104
SLURM_JOB_ID=804384
PROJECT_DIR=/globalsc/users/b/a/baffetti/research/TransfomerROM
ENTRYPOINT=Baseline_hpo.py
Activating environment: /globalsc/ulb/atm/baffetti/envs/artfire_new/bin/activate
/globalsc/users/b/a/baffetti/envs/artfire_new/bin/python
/globalsc/users/b/a/baffetti/envs/artfire_new/bin/pip
Python 3.11.3
Sat Apr 25 06:53:48 2026       
+-----------------------------------------------------------------------------------------+
| NVIDIA-SMI 570.124.06             Driver Version: 570.124.06     CUDA Version: 12.8     |
|-----------------------------------------+------------------------+----------------------+
| GPU  Name                 Persistence-M | Bus-Id          Disp.A | Volatile Uncorr. ECC |
| Fan  Temp   Perf          Pwr:Usage/Cap |           Memory-Usage | GPU-Util  Compute M. |
|                                         |                        |               MIG M. |
|=========================================+========================+======================|
|   0  NVIDIA RTX 6000 Ada Gene...    On  |   00000000:01:00.0 Off |                  Off |
| 47%   62C    P0             77W /  300W |       2MiB /  49140MiB |      0%      Default |
|                                         |                        |                  N/A |
+-----------------------------------------+------------------------+----------------------+
                                                                                         
+-----------------------------------------------------------------------------------------+
| Processes:                                                                              |
|  GPU   GI   CI              PID   Type   Process name                        GPU Memory |
|        ID   ID                                                               Usage      |
|=========================================================================================|
|  No running processes found                                                             |
+-----------------------------------------------------------------------------------------+
Python usato:
/globalsc/users/b/a/baffetti/envs/artfire_new/bin/python
/globalsc/users/b/a/baffetti/envs/artfire_new/bin/python
Torch test:
2.5.0+cu124
[I 2026-04-25 08:22:07,973] Trial 25 finished with value: 0.007792114476497109 and parameters: {'lr': 0.00045087267311343473, 'weight_decay': 0.001008222564149055, 'optimizer': 'adamw', 'use_lookahead': False, 'gradient_clip': 5.0, 'batch_size': 1, 'scheduler_power': 3, 'warmup_steps': 17, 'min_lr_ratio': 0.15182481140499274, 'base_channels': 48, 'use_residual': True}. Best is trial 10 with value: 0.0009712135661519259.
[I 2026-04-25 08:38:37,267] Trial 26 pruned. 
[I 2026-04-25 09:32:10,336] Trial 27 finished with value: 0.0024838768059035413 and parameters: {'lr': 0.0023924465382235156, 'weight_decay': 0.00011945914953177276, 'optimizer': 'adam', 'use_lookahead': False, 'gradient_clip': 3.0, 'batch_size': 4, 'scheduler_power': 3, 'warmup_steps': 11, 'min_lr_ratio': 0.12985626288620725, 'base_channels': 64, 'use_residual': True}. Best is trial 10 with value: 0.0009712135661519259.
[I 2026-04-25 10:24:20,290] Trial 28 finished with value: 0.006671265218205548 and parameters: {'lr': 0.0037471015670562796, 'weight_decay': 0.0006395744133832015, 'optimizer': 'adam', 'use_lookahead': False, 'gradient_clip': 3.0, 'batch_size': 4, 'scheduler_power': 3, 'warmup_steps': 5, 'min_lr_ratio': 0.11157563794831886, 'base_channels': 32, 'use_residual': True}. Best is trial 10 with value: 0.0009712135661519259.
[I 2026-04-25 11:14:21,714] Trial 29 finished with value: 0.004030623279411245 and parameters: {'lr': 0.0007903033914327362, 'weight_decay': 4.75950520431744e-05, 'optimizer': 'adam', 'use_lookahead': False, 'gradient_clip': 3.0, 'batch_size': 8, 'scheduler_power': 3, 'warmup_steps': 8, 'min_lr_ratio': 0.1998923901630728, 'base_channels': 64, 'use_residual': True}. Best is trial 10 with value: 0.0009712135661519259.
[I 2026-04-25 11:28:30,625] Trial 30 pruned. 
[I 2026-04-25 12:21:36,948] Trial 31 finished with value: 0.007251238462993422 and parameters: {'lr': 0.0029508873077338997, 'weight_decay': 0.00024687478882101253, 'optimizer': 'adam', 'use_lookahead': False, 'gradient_clip': 3.0, 'batch_size': 4, 'scheduler_power': 2, 'warmup_steps': 15, 'min_lr_ratio': 0.1117691757218398, 'base_channels': 64, 'use_residual': True}. Best is trial 10 with value: 0.0009712135661519259.
[I 2026-04-25 13:28:21,088] Trial 32 finished with value: 0.011269917208197954 and parameters: {'lr': 0.00388985470203852, 'weight_decay': 0.000442008499170847, 'optimizer': 'adamw', 'use_lookahead': False, 'gradient_clip': 5.0, 'batch_size': 2, 'scheduler_power': 3, 'warmup_steps': 6, 'min_lr_ratio': 0.14445003938074263, 'base_channels': 64, 'use_residual': True}. Best is trial 10 with value: 0.0009712135661519259.
[I 2026-04-25 14:26:29,912] Trial 33 finished with value: 0.006925374843381547 and parameters: {'lr': 0.0013860795434669127, 'weight_decay': 0.0006332519227411934, 'optimizer': 'adam', 'use_lookahead': False, 'gradient_clip': 1.0, 'batch_size': 4, 'scheduler_power': 3, 'warmup_steps': 16, 'min_lr_ratio': 0.21120627184449936, 'base_channels': 48, 'use_residual': True}. Best is trial 10 with value: 0.0009712135661519259.
[I 2026-04-25 14:42:39,497] Trial 34 pruned. 
[I 2026-04-25 15:42:04,454] Trial 35 finished with value: 0.001818841091684393 and parameters: {'lr': 0.001113597332270742, 'weight_decay': 3.83579939181154e-05, 'optimizer': 'adamw', 'use_lookahead': False, 'gradient_clip': 5.0, 'batch_size': 4, 'scheduler_power': 3, 'warmup_steps': 7, 'min_lr_ratio': 0.07010896205606129, 'base_channels': 64, 'use_residual': True}. Best is trial 10 with value: 0.0009712135661519259.
[I 2026-04-25 16:32:20,945] Trial 36 finished with value: 0.003917047324766581 and parameters: {'lr': 0.0007138693598731919, 'weight_decay': 2.3199796172637414e-05, 'optimizer': 'adamw', 'use_lookahead': False, 'gradient_clip': 5.0, 'batch_size': 8, 'scheduler_power': 3, 'warmup_steps': 8, 'min_lr_ratio': 0.0869094060011483, 'base_channels': 64, 'use_residual': True}. Best is trial 10 with value: 0.0009712135661519259.
[I 2026-04-25 17:28:22,202] Trial 37 finished with value: 0.000994620186503272 and parameters: {'lr': 0.0027783116232005084, 'weight_decay': 9.210658486775538e-06, 'optimizer': 'adamw', 'use_lookahead': False, 'gradient_clip': 5.0, 'batch_size': 4, 'scheduler_power': 3, 'warmup_steps': 5, 'min_lr_ratio': 0.08105070289618792, 'base_channels': 64, 'use_residual': True}. Best is trial 10 with value: 0.0009712135661519259.
[I 2026-04-25 17:52:13,680] Trial 38 pruned. 
[I 2026-04-25 18:07:39,155] Trial 39 pruned. 
[I 2026-04-25 18:58:38,751] Trial 40 finished with value: 0.00533672293799149 and parameters: {'lr': 0.002927291757286325, 'weight_decay': 0.0010678599023584876, 'optimizer': 'adamw', 'use_lookahead': True, 'gradient_clip': -1.0, 'batch_size': 8, 'scheduler_power': 2, 'warmup_steps': 20, 'min_lr_ratio': 0.12424181111143831, 'base_channels': 64, 'use_residual': True}. Best is trial 10 with value: 0.0009712135661519259.
[I 2026-04-25 19:13:54,420] Trial 41 pruned. 
[I 2026-04-25 20:08:29,148] Trial 42 finished with value: 0.009960567256486093 and parameters: {'lr': 0.0022663041911506867, 'weight_decay': 1.1963990871175458e-06, 'optimizer': 'adam', 'use_lookahead': False, 'gradient_clip': 5.0, 'batch_size': 4, 'scheduler_power': 3, 'warmup_steps': 6, 'min_lr_ratio': 0.09602764142395437, 'base_channels': 64, 'use_residual': True}. Best is trial 10 with value: 0.0009712135661519259.
[I 2026-04-25 20:23:27,678] Trial 43 pruned. 
[I 2026-04-25 21:06:51,114] Trial 44 pruned. 
[I 2026-04-25 22:00:42,415] Trial 45 finished with value: 0.006246378398626237 and parameters: {'lr': 0.004867652228374756, 'weight_decay': 2.049618516515245e-06, 'optimizer': 'adamw', 'use_lookahead': False, 'gradient_clip': 5.0, 'batch_size': 4, 'scheduler_power': 2, 'warmup_steps': 12, 'min_lr_ratio': 0.08130769861226754, 'base_channels': 48, 'use_residual': True}. Best is trial 10 with value: 0.0009712135661519259.
[I 2026-04-25 22:55:06,176] Trial 46 finished with value: 0.0011934436763309545 and parameters: {'lr': 0.00265688667339584, 'weight_decay': 0.0006106090252977338, 'optimizer': 'adamw', 'use_lookahead': False, 'gradient_clip': 5.0, 'batch_size': 4, 'scheduler_power': 2, 'warmup_steps': 8, 'min_lr_ratio': 0.028458075473105353, 'base_channels': 64, 'use_residual': True}. Best is trial 10 with value: 0.0009712135661519259.
[I 2026-04-25 23:49:44,270] Trial 47 finished with value: 0.001069806031001782 and parameters: {'lr': 0.004955123809513518, 'weight_decay': 2.6817756122491158e-05, 'optimizer': 'adamw', 'use_lookahead': True, 'gradient_clip': 5.0, 'batch_size': 4, 'scheduler_power': 3, 'warmup_steps': 5, 'min_lr_ratio': 0.08789849211187059, 'base_channels': 64, 'use_residual': True}. Best is trial 10 with value: 0.0009712135661519259.
[I 2026-04-26 00:04:33,543] Trial 48 pruned. 
[I 2026-04-26 00:59:05,409] Trial 49 finished with value: 0.00369916097386866 and parameters: {'lr': 0.003960534449022557, 'weight_decay': 2.871065198264784e-05, 'optimizer': 'adamw', 'use_lookahead': True, 'gradient_clip': -1.0, 'batch_size': 4, 'scheduler_power': 3, 'warmup_steps': 3, 'min_lr_ratio': 0.21453777582713554, 'base_channels': 64, 'use_residual': True}. Best is trial 10 with value: 0.0009712135661519259.
[I 2026-04-26 01:53:29,815] Trial 50 finished with value: 0.0017135323730070849 and parameters: {'lr': 0.0025238327103948013, 'weight_decay': 0.002436618694210466, 'optimizer': 'adamw', 'use_lookahead': False, 'gradient_clip': 5.0, 'batch_size': 4, 'scheduler_power': 1, 'warmup_steps': 4, 'min_lr_ratio': 0.04604391642320432, 'base_channels': 64, 'use_residual': True}. Best is trial 10 with value: 0.0009712135661519259.
[I 2026-04-26 02:08:01,676] Trial 51 pruned. 
[I 2026-04-26 02:22:46,017] Trial 52 pruned. 
[I 2026-04-26 02:57:28,472] Trial 53 pruned. 
[I 2026-04-26 03:12:37,651] Trial 54 pruned. 
[I 2026-04-26 04:03:27,678] Trial 55 finished with value: 0.0028123405988554695 and parameters: {'lr': 0.0020734057047871192, 'weight_decay': 0.005832959433713654, 'optimizer': 'adamw', 'use_lookahead': False, 'gradient_clip': 5.0, 'batch_size': 8, 'scheduler_power': 1, 'warmup_steps': 3, 'min_lr_ratio': 0.09626640373625947, 'base_channels': 64, 'use_residual': True}. Best is trial 10 with value: 0.0009712135661519259.
[I 2026-04-26 05:00:23,145] Trial 56 finished with value: 0.0030769240123698035 and parameters: {'lr': 0.0011981791508291354, 'weight_decay': 0.00011084596027271828, 'optimizer': 'adam', 'use_lookahead': True, 'gradient_clip': 5.0, 'batch_size': 4, 'scheduler_power': 3, 'warmup_steps': 1, 'min_lr_ratio': 0.0791745801611668, 'base_channels': 64, 'use_residual': True}. Best is trial 10 with value: 0.0009712135661519259.
[I 2026-04-26 05:55:26,792] Trial 57 finished with value: 0.001041611932167733 and parameters: {'lr': 0.0019155124712434348, 'weight_decay': 8.036459521430462e-05, 'optimizer': 'adamw', 'use_lookahead': False, 'gradient_clip': 5.0, 'batch_size': 4, 'scheduler_power': 2, 'warmup_steps': 7, 'min_lr_ratio': 0.03545927811148616, 'base_channels': 64, 'use_residual': True}. Best is trial 10 with value: 0.0009712135661519259.
[I 2026-04-26 06:10:30,115] Trial 58 pruned. 
[I 2026-04-26 06:27:32,566] Trial 59 pruned. 
[I 2026-04-26 06:51:27,456] Trial 60 pruned. 
[I 2026-04-26 07:45:52,558] Trial 61 finished with value: 0.0017110646494689424 and parameters: {'lr': 0.0034060660451254074, 'weight_decay': 0.0010769561000144973, 'optimizer': 'adamw', 'use_lookahead': True, 'gradient_clip': 5.0, 'batch_size': 4, 'scheduler_power': 2, 'warmup_steps': 4, 'min_lr_ratio': 0.14938907972377852, 'base_channels': 48, 'use_residual': True}. Best is trial 10 with value: 0.0009712135661519259.
[I 2026-04-26 08:03:15,351] Trial 62 pruned. 
[I 2026-04-26 08:56:59,107] Trial 63 finished with value: 0.0023780116131780923 and parameters: {'lr': 0.0018028526335793916, 'weight_decay': 0.0003220606758824004, 'optimizer': 'adamw', 'use_lookahead': False, 'gradient_clip': 5.0, 'batch_size': 4, 'scheduler_power': 2, 'warmup_steps': 1, 'min_lr_ratio': 0.21688105817207856, 'base_channels': 48, 'use_residual': True}. Best is trial 10 with value: 0.0009712135661519259.
[I 2026-04-26 09:54:00,285] Trial 64 finished with value: 0.0020341820083558558 and parameters: {'lr': 0.0021175477606547744, 'weight_decay': 0.00029518140446136386, 'optimizer': 'adamw', 'use_lookahead': False, 'gradient_clip': 5.0, 'batch_size': 4, 'scheduler_power': 1, 'warmup_steps': 12, 'min_lr_ratio': 0.09552445909146554, 'base_channels': 64, 'use_residual': True}. Best is trial 10 with value: 0.0009712135661519259.
Best params saved to: baseline_hpo_best_params_unet.yaml
Best value (val MSE): 0.000971
[Sun Apr 26 09:54:02 AM CEST 2026] Job finished
