[Wed Apr 22 05:10:15 AM CEST 2026] Job started on ly-w205
SLURM_JOB_ID=795626
PROJECT_DIR=/globalsc/users/b/a/baffetti/research/TransfomerROM
ENTRYPOINT=Baseline_hpo.py
Activating environment: /globalsc/ulb/atm/baffetti/envs/artfire_new/bin/activate
/globalsc/users/b/a/baffetti/envs/artfire_new/bin/python
/globalsc/users/b/a/baffetti/envs/artfire_new/bin/pip
Python 3.11.3
Wed Apr 22 05:10:15 2026       
+-----------------------------------------------------------------------------------------+
| NVIDIA-SMI 570.124.06             Driver Version: 570.124.06     CUDA Version: 12.8     |
|-----------------------------------------+------------------------+----------------------+
| GPU  Name                 Persistence-M | Bus-Id          Disp.A | Volatile Uncorr. ECC |
| Fan  Temp   Perf          Pwr:Usage/Cap |           Memory-Usage | GPU-Util  Compute M. |
|                                         |                        |               MIG M. |
|=========================================+========================+======================|
|   0  NVIDIA RTX 6000 Ada Gene...    On  |   00000000:01:00.0 Off |                  Off |
| 30%   46C    P5             57W /  300W |       2MiB /  49140MiB |      0%      Default |
|                                         |                        |                  N/A |
+-----------------------------------------+------------------------+----------------------+
                                                                                         
+-----------------------------------------------------------------------------------------+
| Processes:                                                                              |
|  GPU   GI   CI              PID   Type   Process name                        GPU Memory |
|        ID   ID                                                               Usage      |
|=========================================================================================|
|  No running processes found                                                             |
+-----------------------------------------------------------------------------------------+
Python usato:
/globalsc/users/b/a/baffetti/envs/artfire_new/bin/python
/globalsc/users/b/a/baffetti/envs/artfire_new/bin/python
Torch test:
2.5.0+cu124
[I 2026-04-22 05:58:19,561] Trial 7 finished with value: 0.002602524765943353 and parameters: {'lr': 0.0001025350969016849, 'weight_decay': 0.006351221010640704, 'optimizer': 'adamw', 'use_lookahead': True, 'gradient_clip': 1.0, 'batch_size': 2, 'scheduler_power': 1, 'warmup_steps': 3, 'min_lr_ratio': 0.1590786990501735, 'modes1': 10, 'modes2': 10, 'modes3': 4, 'width': 32, 'n_layers': 6}. Best is trial 5 with value: 0.0009701725413292848.
[I 2026-04-22 06:53:31,272] Trial 8 finished with value: 0.0034275919280795228 and parameters: {'lr': 0.0015199881220083974, 'weight_decay': 1.6536937182824424e-05, 'optimizer': 'adam', 'use_lookahead': True, 'gradient_clip': 3.0, 'batch_size': 1, 'scheduler_power': 1, 'warmup_steps': 20, 'min_lr_ratio': 0.38981508344694615, 'modes1': 4, 'modes2': 10, 'modes3': 8, 'width': 24, 'n_layers': 6}. Best is trial 5 with value: 0.0009701725413292848.
[I 2026-04-22 07:50:37,523] Trial 9 finished with value: 0.0020278881319697848 and parameters: {'lr': 0.0012141307774357361, 'weight_decay': 6.235377135673162e-06, 'optimizer': 'adam', 'use_lookahead': False, 'gradient_clip': -1.0, 'batch_size': 1, 'scheduler_power': 1, 'warmup_steps': 6, 'min_lr_ratio': 0.3675070273856514, 'modes1': 6, 'modes2': 10, 'modes3': 6, 'width': 20, 'n_layers': 6}. Best is trial 5 with value: 0.0009701725413292848.
[I 2026-04-22 08:35:31,156] Trial 10 finished with value: 0.10012217727867333 and parameters: {'lr': 4.707954411452835e-05, 'weight_decay': 4.3805807679056575e-05, 'optimizer': 'adamw', 'use_lookahead': False, 'gradient_clip': 1.0, 'batch_size': 8, 'scheduler_power': 2, 'warmup_steps': 16, 'min_lr_ratio': 0.44908473696251167, 'modes1': 10, 'modes2': 6, 'modes3': 4, 'width': 12, 'n_layers': 6}. Best is trial 5 with value: 0.0009701725413292848.
[I 2026-04-22 09:25:50,973] Trial 11 finished with value: 0.0009701725413292848 and parameters: {'lr': 0.003959281492292679, 'weight_decay': 1.0165510266418738e-05, 'optimizer': 'adamw', 'use_lookahead': True, 'gradient_clip': -1.0, 'batch_size': 1, 'scheduler_power': 3, 'warmup_steps': 5, 'min_lr_ratio': 0.3393464182288805, 'modes1': 4, 'modes2': 6, 'modes3': 4, 'width': 16, 'n_layers': 5}. Best is trial 5 with value: 0.0009701725413292848.
[I 2026-04-22 09:38:41,658] Trial 12 pruned. 
[I 2026-04-22 10:24:09,055] Trial 13 finished with value: 0.0014066945786613066 and parameters: {'lr': 0.0042571011670314305, 'weight_decay': 2.4103869167767554e-05, 'optimizer': 'adamw', 'use_lookahead': False, 'gradient_clip': -1.0, 'batch_size': 4, 'scheduler_power': 3, 'warmup_steps': 6, 'min_lr_ratio': 0.25854500633496535, 'modes1': 4, 'modes2': 6, 'modes3': 6, 'width': 16, 'n_layers': 4}. Best is trial 5 with value: 0.0009701725413292848.
[I 2026-04-22 10:49:52,263] Trial 14 pruned. 
[I 2026-04-22 11:00:31,456] Trial 15 pruned. 
[I 2026-04-22 11:46:28,531] Trial 16 finished with value: 0.0013748679794622837 and parameters: {'lr': 0.004294493615716391, 'weight_decay': 2.8655480446364478e-05, 'optimizer': 'adamw', 'use_lookahead': True, 'gradient_clip': 5.0, 'batch_size': 2, 'scheduler_power': 3, 'warmup_steps': 6, 'min_lr_ratio': 0.3260188027897052, 'modes1': 4, 'modes2': 6, 'modes3': 4, 'width': 16, 'n_layers': 6}. Best is trial 5 with value: 0.0009701725413292848.
[I 2026-04-22 12:03:56,078] Trial 17 pruned. 
[I 2026-04-22 12:55:21,720] Trial 18 finished with value: 0.0007978736383626489 and parameters: {'lr': 0.00205471121808793, 'weight_decay': 1.1851038532007607e-05, 'optimizer': 'adamw', 'use_lookahead': True, 'gradient_clip': -1.0, 'batch_size': 1, 'scheduler_power': 3, 'warmup_steps': 2, 'min_lr_ratio': 0.20154009384103852, 'modes1': 10, 'modes2': 6, 'modes3': 4, 'width': 16, 'n_layers': 5}. Best is trial 18 with value: 0.0007978736383626489.
[I 2026-04-22 13:07:29,851] Trial 19 pruned. 
[I 2026-04-22 13:18:09,429] Trial 20 pruned. 
[I 2026-04-22 14:09:19,637] Trial 21 finished with value: 0.00034304604219820197 and parameters: {'lr': 0.0017288069352721916, 'weight_decay': 8.931675097346611e-06, 'optimizer': 'adamw', 'use_lookahead': True, 'gradient_clip': 5.0, 'batch_size': 1, 'scheduler_power': 2, 'warmup_steps': 0, 'min_lr_ratio': 0.16742683806983305, 'modes1': 10, 'modes2': 6, 'modes3': 4, 'width': 32, 'n_layers': 4}. Best is trial 21 with value: 0.00034304604219820197.
[I 2026-04-22 14:59:02,165] Trial 22 finished with value: 0.00065050856949686 and parameters: {'lr': 0.0009564725443481001, 'weight_decay': 3.3888136620193936e-05, 'optimizer': 'adamw', 'use_lookahead': True, 'gradient_clip': 5.0, 'batch_size': 1, 'scheduler_power': 2, 'warmup_steps': 6, 'min_lr_ratio': 0.1594843983348554, 'modes1': 10, 'modes2': 8, 'modes3': 4, 'width': 32, 'n_layers': 2}. Best is trial 21 with value: 0.00034304604219820197.
[I 2026-04-22 15:51:31,401] Trial 23 finished with value: 0.00045510183011395605 and parameters: {'lr': 0.0020096294879564307, 'weight_decay': 3.793219397109601e-05, 'optimizer': 'adamw', 'use_lookahead': True, 'gradient_clip': 5.0, 'batch_size': 1, 'scheduler_power': 1, 'warmup_steps': 0, 'min_lr_ratio': 0.19423353459822482, 'modes1': 10, 'modes2': 8, 'modes3': 4, 'width': 32, 'n_layers': 5}. Best is trial 21 with value: 0.00034304604219820197.
[I 2026-04-22 16:41:18,225] Trial 24 finished with value: 0.0004547524539678282 and parameters: {'lr': 0.0004611951410136649, 'weight_decay': 0.00011802470553133936, 'optimizer': 'adamw', 'use_lookahead': True, 'gradient_clip': 5.0, 'batch_size': 1, 'scheduler_power': 2, 'warmup_steps': 6, 'min_lr_ratio': 0.1764559753637723, 'modes1': 10, 'modes2': 8, 'modes3': 6, 'width': 32, 'n_layers': 4}. Best is trial 21 with value: 0.00034304604219820197.
[I 2026-04-22 17:29:54,287] Trial 25 finished with value: 0.000589364449449538 and parameters: {'lr': 0.0013381599779571567, 'weight_decay': 2.9887757841715475e-05, 'optimizer': 'adamw', 'use_lookahead': True, 'gradient_clip': 5.0, 'batch_size': 2, 'scheduler_power': 1, 'warmup_steps': 1, 'min_lr_ratio': 0.13687089653471457, 'modes1': 10, 'modes2': 6, 'modes3': 4, 'width': 32, 'n_layers': 6}. Best is trial 21 with value: 0.00034304604219820197.
[I 2026-04-22 17:42:19,192] Trial 26 pruned. 
[I 2026-04-22 17:54:15,964] Trial 27 pruned. 
[I 2026-04-22 18:37:59,121] Trial 28 finished with value: 0.0006211840984965297 and parameters: {'lr': 0.0015388608700399903, 'weight_decay': 8.476293464010091e-05, 'optimizer': 'adamw', 'use_lookahead': True, 'gradient_clip': 5.0, 'batch_size': 4, 'scheduler_power': 3, 'warmup_steps': 0, 'min_lr_ratio': 0.2009449458835105, 'modes1': 10, 'modes2': 6, 'modes3': 10, 'width': 32, 'n_layers': 3}. Best is trial 21 with value: 0.00034304604219820197.
[I 2026-04-22 19:30:59,099] Trial 29 finished with value: 0.00047193574868583093 and parameters: {'lr': 0.0012534730302281032, 'weight_decay': 5.111901077851857e-06, 'optimizer': 'adamw', 'use_lookahead': True, 'gradient_clip': 1.0, 'batch_size': 1, 'scheduler_power': 1, 'warmup_steps': 1, 'min_lr_ratio': 0.20498975250771104, 'modes1': 8, 'modes2': 8, 'modes3': 8, 'width': 32, 'n_layers': 6}. Best is trial 21 with value: 0.00034304604219820197.
[I 2026-04-22 20:21:07,974] Trial 30 finished with value: 0.0008516710817914557 and parameters: {'lr': 0.0005713080273401165, 'weight_decay': 1.843745066098431e-06, 'optimizer': 'adamw', 'use_lookahead': True, 'gradient_clip': 3.0, 'batch_size': 1, 'scheduler_power': 2, 'warmup_steps': 2, 'min_lr_ratio': 0.18886999665871462, 'modes1': 10, 'modes2': 6, 'modes3': 6, 'width': 24, 'n_layers': 3}. Best is trial 21 with value: 0.00034304604219820197.
[I 2026-04-22 20:33:15,433] Trial 31 pruned. 
[I 2026-04-22 21:14:17,384] Trial 32 pruned. 
[I 2026-04-22 21:29:02,408] Trial 33 pruned. 
[I 2026-04-22 21:43:34,219] Trial 34 pruned. 
[I 2026-04-22 22:35:38,199] Trial 35 finished with value: 0.0006901661017469156 and parameters: {'lr': 0.0009502197807426383, 'weight_decay': 1.0987383985292784e-05, 'optimizer': 'adamw', 'use_lookahead': True, 'gradient_clip': 3.0, 'batch_size': 1, 'scheduler_power': 2, 'warmup_steps': 1, 'min_lr_ratio': 0.28361337440831874, 'modes1': 8, 'modes2': 8, 'modes3': 8, 'width': 16, 'n_layers': 6}. Best is trial 21 with value: 0.00034304604219820197.
[I 2026-04-22 22:47:53,451] Trial 36 pruned. 
[I 2026-04-22 22:59:09,283] Trial 37 pruned. 
[I 2026-04-22 23:11:50,323] Trial 38 pruned. 
[I 2026-04-22 23:22:22,286] Trial 39 pruned. 
[I 2026-04-22 23:33:28,241] Trial 40 pruned. 
[I 2026-04-23 00:26:15,576] Trial 41 finished with value: 0.000629465003982438 and parameters: {'lr': 0.0008888644643562752, 'weight_decay': 3.612603905453719e-06, 'optimizer': 'adamw', 'use_lookahead': True, 'gradient_clip': 1.0, 'batch_size': 1, 'scheduler_power': 1, 'warmup_steps': 3, 'min_lr_ratio': 0.2013367533943223, 'modes1': 8, 'modes2': 8, 'modes3': 6, 'width': 20, 'n_layers': 5}. Best is trial 21 with value: 0.00034304604219820197.
[I 2026-04-23 00:37:18,423] Trial 42 pruned. 
