[Tue May  5 05:49:58 PM CEST 2026] Job started on ly-w205
SLURM_JOB_ID=853453
PROJECT_DIR=/globalsc/users/b/a/baffetti/research/TransfomerROM
ENTRYPOINT=CAEst_hpo.py
Activating environment: /globalsc/ulb/atm/baffetti/envs/artfire_new/bin/activate
/globalsc/users/b/a/baffetti/envs/artfire_new/bin/python
/globalsc/users/b/a/baffetti/envs/artfire_new/bin/pip
Python 3.11.3
Tue May  5 17:49:58 2026       
+-----------------------------------------------------------------------------------------+
| NVIDIA-SMI 570.124.06             Driver Version: 570.124.06     CUDA Version: 12.8     |
|-----------------------------------------+------------------------+----------------------+
| GPU  Name                 Persistence-M | Bus-Id          Disp.A | Volatile Uncorr. ECC |
| Fan  Temp   Perf          Pwr:Usage/Cap |           Memory-Usage | GPU-Util  Compute M. |
|                                         |                        |               MIG M. |
|=========================================+========================+======================|
|   0  NVIDIA RTX 6000 Ada Gene...    On  |   00000000:01:00.0 Off |                  Off |
| 30%   37C    P5             72W /  300W |       2MiB /  49140MiB |      0%      Default |
|                                         |                        |                  N/A |
+-----------------------------------------+------------------------+----------------------+
                                                                                         
+-----------------------------------------------------------------------------------------+
| Processes:                                                                              |
|  GPU   GI   CI              PID   Type   Process name                        GPU Memory |
|        ID   ID                                                               Usage      |
|=========================================================================================|
|  No running processes found                                                             |
+-----------------------------------------------------------------------------------------+
Python usato:
/globalsc/users/b/a/baffetti/envs/artfire_new/bin/python
/globalsc/users/b/a/baffetti/envs/artfire_new/bin/python
Torch test:
2.5.0+cu124
CUDA available — running on GPU

Loading datasets from: /globalsc/ulb/atm/baffetti/research/Transformer/ArtFire_files/data/D_t2001_f13_z256_x64.npy
Dataset: 1200 train / 400 val samples, C=13, H=256, W=64

HPO config: 100 trials × 25 epochs on cuda

[I 2026-05-05 17:51:29,171] Trial 200 pruned. 
[I 2026-05-05 17:51:30,123] Trial 201 pruned. 
[I 2026-05-05 17:51:56,868] Trial 202 pruned. 
[I 2026-05-05 17:52:43,851] Trial 203 pruned. 
[I 2026-05-05 17:52:52,588] Trial 204 pruned. 
[I 2026-05-05 17:53:01,669] Trial 205 pruned. 
[I 2026-05-05 17:53:53,143] Trial 206 pruned. 
[I 2026-05-05 17:54:40,196] Trial 207 pruned. 
[I 2026-05-05 17:55:00,902] Trial 208 pruned. 
[I 2026-05-05 17:55:08,849] Trial 209 pruned. 
[I 2026-05-05 17:55:16,558] Trial 210 pruned. 
[I 2026-05-05 17:55:25,619] Trial 211 pruned. 
[I 2026-05-05 17:56:01,000] Trial 212 finished with value: 0.015007870495319367 and parameters: {'arch': '[]→32', 'normalization': None, 'activation': 'silu', 'lr': 0.009722203386684513, 'weight_decay': 0.00010074349483236057, 'optimizer': 'adam', 'use_lookahead': False, 'gradient_clip': 5.0, 'batch_size': 16, 'scheduler_power': 1, 'warmup_steps': 15, 'min_lr_ratio': 0.3708663625837806}. Best is trial 170 with value: 0.01185424342751503.
[I 2026-05-05 17:56:01,215] Trial 213 pruned. 
[I 2026-05-05 17:56:01,428] Trial 214 pruned. 
[I 2026-05-05 17:56:01,637] Trial 215 pruned. 
[I 2026-05-05 17:56:36,914] Trial 216 finished with value: 0.017469979971647263 and parameters: {'arch': '[]→32', 'normalization': None, 'activation': 'silu', 'lr': 0.006897894861767735, 'weight_decay': 1.792795893754809e-05, 'optimizer': 'adam', 'use_lookahead': False, 'gradient_clip': -1.0, 'batch_size': 16, 'scheduler_power': 1, 'warmup_steps': 10, 'min_lr_ratio': 0.47981811104108685}. Best is trial 170 with value: 0.01185424342751503.
[I 2026-05-05 17:59:39,084] Trial 217 finished with value: 0.015635492876172066 and parameters: {'arch': '[]→128', 'normalization': None, 'activation': 'silu', 'lr': 0.005991026474197673, 'weight_decay': 1.5682389852175454e-05, 'optimizer': 'adam', 'use_lookahead': False, 'gradient_clip': 1.0, 'batch_size': 16, 'scheduler_power': 2, 'warmup_steps': 20, 'min_lr_ratio': 0.44724438213877094}. Best is trial 170 with value: 0.01185424342751503.
[I 2026-05-05 17:59:46,860] Trial 218 pruned. 
[I 2026-05-05 17:59:55,635] Trial 219 pruned. 
[I 2026-05-05 18:00:39,630] Trial 220 pruned. 
[I 2026-05-05 18:03:42,015] Trial 221 finished with value: 0.015927699469029902 and parameters: {'arch': '[]→128', 'normalization': None, 'activation': 'elu', 'lr': 0.00512981677521766, 'weight_decay': 2.352900876440296e-05, 'optimizer': 'adam', 'use_lookahead': False, 'gradient_clip': 1.0, 'batch_size': 16, 'scheduler_power': 2, 'warmup_steps': 20, 'min_lr_ratio': 0.3832916232282091}. Best is trial 170 with value: 0.01185424342751503.
[I 2026-05-05 18:06:44,690] Trial 222 finished with value: 0.016590771824121477 and parameters: {'arch': '[]→128', 'normalization': None, 'activation': 'elu', 'lr': 0.005297517868749493, 'weight_decay': 6.276458092645626e-05, 'optimizer': 'adam', 'use_lookahead': False, 'gradient_clip': 1.0, 'batch_size': 16, 'scheduler_power': 2, 'warmup_steps': 19, 'min_lr_ratio': 0.3115402755906282}. Best is trial 170 with value: 0.01185424342751503.
[I 2026-05-05 18:09:47,488] Trial 223 finished with value: 0.016777809113264083 and parameters: {'arch': '[]→128', 'normalization': None, 'activation': 'elu', 'lr': 0.005496718329580283, 'weight_decay': 5.465650732317206e-05, 'optimizer': 'adam', 'use_lookahead': False, 'gradient_clip': 1.0, 'batch_size': 16, 'scheduler_power': 2, 'warmup_steps': 20, 'min_lr_ratio': 0.3076244233697479}. Best is trial 170 with value: 0.01185424342751503.
[I 2026-05-05 18:12:50,242] Trial 224 finished with value: 0.012431400455534458 and parameters: {'arch': '[]→128', 'normalization': None, 'activation': 'silu', 'lr': 0.008534978891313752, 'weight_decay': 0.0001981149049624431, 'optimizer': 'adamw', 'use_lookahead': False, 'gradient_clip': 5.0, 'batch_size': 16, 'scheduler_power': 1, 'warmup_steps': 19, 'min_lr_ratio': 0.49103760992358014}. Best is trial 170 with value: 0.01185424342751503.
[I 2026-05-05 18:13:25,768] Trial 225 finished with value: 0.016085495948791505 and parameters: {'arch': '[64]→128', 'normalization': None, 'activation': 'silu', 'lr': 0.006049309037580432, 'weight_decay': 4.329368361744066e-05, 'optimizer': 'adam', 'use_lookahead': False, 'gradient_clip': 5.0, 'batch_size': 16, 'scheduler_power': 1, 'warmup_steps': 14, 'min_lr_ratio': 0.40574039786303984}. Best is trial 170 with value: 0.01185424342751503.
[I 2026-05-05 18:13:35,141] Trial 226 pruned. 
[I 2026-05-05 18:16:37,880] Trial 227 finished with value: 0.013087840899825096 and parameters: {'arch': '[]→128', 'normalization': None, 'activation': 'silu', 'lr': 0.0077769822417394965, 'weight_decay': 0.000274227300625943, 'optimizer': 'adamw', 'use_lookahead': False, 'gradient_clip': 1.0, 'batch_size': 16, 'scheduler_power': 2, 'warmup_steps': 17, 'min_lr_ratio': 0.48378369762405143}. Best is trial 170 with value: 0.01185424342751503.
[I 2026-05-05 18:16:46,658] Trial 228 pruned. 
[I 2026-05-05 18:18:07,298] Trial 229 pruned. 
[I 2026-05-05 18:18:16,871] Trial 230 pruned. 
[I 2026-05-05 18:21:19,754] Trial 231 finished with value: 0.012114720307290555 and parameters: {'arch': '[]→128', 'normalization': None, 'activation': 'silu', 'lr': 0.008956642205981831, 'weight_decay': 0.0002682983199180418, 'optimizer': 'adamw', 'use_lookahead': False, 'gradient_clip': 1.0, 'batch_size': 16, 'scheduler_power': 1, 'warmup_steps': 20, 'min_lr_ratio': 0.47790978728431605}. Best is trial 170 with value: 0.01185424342751503.
[I 2026-05-05 18:21:28,899] Trial 232 pruned. 
[I 2026-05-05 18:21:29,114] Trial 233 pruned. 
[I 2026-05-05 18:24:31,917] Trial 234 finished with value: 0.012834939211606979 and parameters: {'arch': '[]→128', 'normalization': None, 'activation': 'silu', 'lr': 0.009057671655033118, 'weight_decay': 1.8082865109279336e-05, 'optimizer': 'adam', 'use_lookahead': False, 'gradient_clip': 1.0, 'batch_size': 16, 'scheduler_power': 2, 'warmup_steps': 17, 'min_lr_ratio': 0.4866912712969513}. Best is trial 170 with value: 0.01185424342751503.
[I 2026-05-05 18:27:34,666] Trial 235 finished with value: 0.012265079878270626 and parameters: {'arch': '[]→128', 'normalization': None, 'activation': 'silu', 'lr': 0.008850455341646931, 'weight_decay': 3.7354961176444394e-05, 'optimizer': 'adam', 'use_lookahead': False, 'gradient_clip': 1.0, 'batch_size': 16, 'scheduler_power': 2, 'warmup_steps': 17, 'min_lr_ratio': 0.4615942443718886}. Best is trial 170 with value: 0.01185424342751503.
[I 2026-05-05 18:30:37,559] Trial 236 finished with value: 0.013210885934531688 and parameters: {'arch': '[]→128', 'normalization': None, 'activation': 'silu', 'lr': 0.008383090354832635, 'weight_decay': 1.3003845171910907e-05, 'optimizer': 'adam', 'use_lookahead': False, 'gradient_clip': 1.0, 'batch_size': 16, 'scheduler_power': 2, 'warmup_steps': 13, 'min_lr_ratio': 0.48371131004876144}. Best is trial 170 with value: 0.01185424342751503.
[I 2026-05-05 18:31:24,766] Trial 237 pruned. 
[I 2026-05-05 18:34:27,570] Trial 238 finished with value: 0.015587573498487472 and parameters: {'arch': '[]→128', 'normalization': None, 'activation': 'silu', 'lr': 0.005666722625753279, 'weight_decay': 2.3302745242930624e-05, 'optimizer': 'adam', 'use_lookahead': False, 'gradient_clip': 1.0, 'batch_size': 16, 'scheduler_power': 2, 'warmup_steps': 20, 'min_lr_ratio': 0.47229376853305766}. Best is trial 170 with value: 0.01185424342751503.
[I 2026-05-05 18:35:11,732] Trial 239 pruned. 
[I 2026-05-05 18:38:14,599] Trial 240 finished with value: 0.014573551155626774 and parameters: {'arch': '[]→128', 'normalization': None, 'activation': 'silu', 'lr': 0.007649639931048726, 'weight_decay': 0.0013583594673908705, 'optimizer': 'adamw', 'use_lookahead': True, 'gradient_clip': 1.0, 'batch_size': 16, 'scheduler_power': 1, 'warmup_steps': 14, 'min_lr_ratio': 0.48466696040960633}. Best is trial 170 with value: 0.01185424342751503.
[I 2026-05-05 18:38:58,719] Trial 241 pruned. 
[I 2026-05-05 18:39:14,885] Trial 242 pruned. 
[I 2026-05-05 18:42:17,095] Trial 243 finished with value: 0.01560881681740284 and parameters: {'arch': '[]→128', 'normalization': None, 'activation': 'relu', 'lr': 0.004893358232344108, 'weight_decay': 0.00011887108519620805, 'optimizer': 'adamw', 'use_lookahead': False, 'gradient_clip': 1.0, 'batch_size': 16, 'scheduler_power': 1, 'warmup_steps': 20, 'min_lr_ratio': 0.43593488035507916}. Best is trial 170 with value: 0.01185424342751503.
[I 2026-05-05 18:43:03,677] Trial 244 pruned. 
[I 2026-05-05 18:46:06,364] Trial 245 finished with value: 0.012748314067721367 and parameters: {'arch': '[]→128', 'normalization': None, 'activation': 'silu', 'lr': 0.00994899405405638, 'weight_decay': 1.0798188517537154e-05, 'optimizer': 'adam', 'use_lookahead': False, 'gradient_clip': 1.0, 'batch_size': 16, 'scheduler_power': 1, 'warmup_steps': 6, 'min_lr_ratio': 0.41850244247321805}. Best is trial 170 with value: 0.01185424342751503.
[I 2026-05-05 18:49:08,928] Trial 246 finished with value: 0.012195468582212925 and parameters: {'arch': '[]→128', 'normalization': None, 'activation': 'silu', 'lr': 0.009858958159782884, 'weight_decay': 1.6534466731526763e-05, 'optimizer': 'adam', 'use_lookahead': False, 'gradient_clip': 1.0, 'batch_size': 16, 'scheduler_power': 1, 'warmup_steps': 8, 'min_lr_ratio': 0.4430709241412302}. Best is trial 170 with value: 0.01185424342751503.
[I 2026-05-05 18:49:09,162] Trial 247 pruned. 
[I 2026-05-05 18:49:44,680] Trial 248 finished with value: 0.015486604273319245 and parameters: {'arch': '[64]→128', 'normalization': None, 'activation': 'silu', 'lr': 0.008038606978701072, 'weight_decay': 2.0030491919493132e-05, 'optimizer': 'adam', 'use_lookahead': False, 'gradient_clip': 1.0, 'batch_size': 16, 'scheduler_power': 1, 'warmup_steps': 9, 'min_lr_ratio': 0.4645445908630205}. Best is trial 170 with value: 0.01185424342751503.
[I 2026-05-05 18:51:27,177] Trial 249 pruned. 
[I 2026-05-05 18:52:29,370] Trial 250 finished with value: 0.01773797959089279 and parameters: {'arch': '[]→64', 'normalization': None, 'activation': 'silu', 'lr': 0.007053299322806712, 'weight_decay': 0.0006044075984710383, 'optimizer': 'adamw', 'use_lookahead': True, 'gradient_clip': 1.0, 'batch_size': 16, 'scheduler_power': 2, 'warmup_steps': 11, 'min_lr_ratio': 0.4392193497518207}. Best is trial 170 with value: 0.01185424342751503.
[I 2026-05-05 18:52:57,707] Trial 251 pruned. 
[I 2026-05-05 18:53:06,534] Trial 252 pruned. 
[I 2026-05-05 18:53:53,796] Trial 253 pruned. 
[I 2026-05-05 18:56:56,864] Trial 254 finished with value: 0.013943965509533883 and parameters: {'arch': '[]→128', 'normalization': None, 'activation': 'silu', 'lr': 0.00705970423534961, 'weight_decay': 0.0003737094725259254, 'optimizer': 'adamw', 'use_lookahead': False, 'gradient_clip': 1.0, 'batch_size': 16, 'scheduler_power': 2, 'warmup_steps': 16, 'min_lr_ratio': 0.4728652416725775}. Best is trial 170 with value: 0.01185424342751503.
[I 2026-05-05 18:59:59,824] Trial 255 finished with value: 0.014243055544793605 and parameters: {'arch': '[]→128', 'normalization': None, 'activation': 'silu', 'lr': 0.0068091730290310995, 'weight_decay': 0.0001873161752852793, 'optimizer': 'adamw', 'use_lookahead': False, 'gradient_clip': 1.0, 'batch_size': 16, 'scheduler_power': 2, 'warmup_steps': 12, 'min_lr_ratio': 0.4572981268254477}. Best is trial 170 with value: 0.01185424342751503.
[I 2026-05-05 19:00:00,031] Trial 256 pruned. 
[I 2026-05-05 19:03:02,911] Trial 257 finished with value: 0.013854703754186631 and parameters: {'arch': '[]→128', 'normalization': None, 'activation': 'silu', 'lr': 0.008090295316728233, 'weight_decay': 0.0008474473590677048, 'optimizer': 'adamw', 'use_lookahead': False, 'gradient_clip': 1.0, 'batch_size': 16, 'scheduler_power': 1, 'warmup_steps': 20, 'min_lr_ratio': 0.4650363245151768}. Best is trial 170 with value: 0.01185424342751503.
[I 2026-05-05 19:06:05,654] Trial 258 finished with value: 0.015500822961330414 and parameters: {'arch': '[]→128', 'normalization': None, 'activation': 'silu', 'lr': 0.005482938315083142, 'weight_decay': 0.0005402219172161726, 'optimizer': 'adamw', 'use_lookahead': False, 'gradient_clip': 1.0, 'batch_size': 16, 'scheduler_power': 1, 'warmup_steps': 15, 'min_lr_ratio': 0.49986579845895546}. Best is trial 170 with value: 0.01185424342751503.
[I 2026-05-05 19:09:08,412] Trial 259 finished with value: 0.012392621077597142 and parameters: {'arch': '[]→128', 'normalization': None, 'activation': 'silu', 'lr': 0.009358923700653715, 'weight_decay': 1.1984439288976698e-05, 'optimizer': 'adamw', 'use_lookahead': False, 'gradient_clip': 1.0, 'batch_size': 16, 'scheduler_power': 2, 'warmup_steps': 13, 'min_lr_ratio': 0.47111383438249366}. Best is trial 170 with value: 0.01185424342751503.
[I 2026-05-05 19:12:11,175] Trial 260 finished with value: 0.014547467567026615 and parameters: {'arch': '[]→128', 'normalization': None, 'activation': 'silu', 'lr': 0.008248208712217087, 'weight_decay': 0.0001271930976637765, 'optimizer': 'adamw', 'use_lookahead': False, 'gradient_clip': 1.0, 'batch_size': 16, 'scheduler_power': 2, 'warmup_steps': 11, 'min_lr_ratio': 0.2784292458357692}. Best is trial 170 with value: 0.01185424342751503.
[I 2026-05-05 19:15:13,920] Trial 261 finished with value: 0.012257171794772148 and parameters: {'arch': '[]→128', 'normalization': None, 'activation': 'silu', 'lr': 0.009954038763802442, 'weight_decay': 0.00019586963736971884, 'optimizer': 'adamw', 'use_lookahead': False, 'gradient_clip': 1.0, 'batch_size': 16, 'scheduler_power': 2, 'warmup_steps': 18, 'min_lr_ratio': 0.33649860587238273}. Best is trial 170 with value: 0.01185424342751503.
[I 2026-05-05 19:15:47,769] Trial 262 finished with value: 0.016315604783594607 and parameters: {'arch': '[16]→128', 'normalization': None, 'activation': 'silu', 'lr': 0.009322185352418527, 'weight_decay': 1.3352009452037679e-05, 'optimizer': 'adam', 'use_lookahead': False, 'gradient_clip': 1.0, 'batch_size': 16, 'scheduler_power': 1, 'warmup_steps': 0, 'min_lr_ratio': 0.37118869442842595}. Best is trial 170 with value: 0.01185424342751503.
[I 2026-05-05 19:16:14,865] Trial 263 pruned. 
[I 2026-05-05 19:16:24,024] Trial 264 pruned. 
[I 2026-05-05 19:17:08,057] Trial 265 pruned. 
[I 2026-05-05 19:17:53,182] Trial 266 pruned. 
[I 2026-05-05 19:19:42,905] Trial 267 pruned. 
[I 2026-05-05 19:19:52,167] Trial 268 pruned. 
[I 2026-05-05 19:22:54,579] Trial 269 finished with value: 0.013322145789861678 and parameters: {'arch': '[]→128', 'normalization': None, 'activation': 'silu', 'lr': 0.009873397967988907, 'weight_decay': 0.001315874063210502, 'optimizer': 'adamw', 'use_lookahead': False, 'gradient_clip': 1.0, 'batch_size': 16, 'scheduler_power': 1, 'warmup_steps': 20, 'min_lr_ratio': 0.28178969678019183}. Best is trial 170 with value: 0.01185424342751503.
[I 2026-05-05 19:25:57,277] Trial 270 finished with value: 0.012094931565225125 and parameters: {'arch': '[]→128', 'normalization': None, 'activation': 'silu', 'lr': 0.009857158133851854, 'weight_decay': 1.9133932620516683e-05, 'optimizer': 'adamw', 'use_lookahead': False, 'gradient_clip': 1.0, 'batch_size': 16, 'scheduler_power': 2, 'warmup_steps': 12, 'min_lr_ratio': 0.48930178444798234}. Best is trial 170 with value: 0.01185424342751503.
[I 2026-05-05 19:26:12,375] Trial 271 pruned. 
[I 2026-05-05 19:29:15,101] Trial 272 finished with value: 0.012202599495649337 and parameters: {'arch': '[]→128', 'normalization': None, 'activation': 'silu', 'lr': 0.009787183350864584, 'weight_decay': 8.667472682050828e-05, 'optimizer': 'adamw', 'use_lookahead': False, 'gradient_clip': 1.0, 'batch_size': 16, 'scheduler_power': 2, 'warmup_steps': 18, 'min_lr_ratio': 0.40537505799731083}. Best is trial 170 with value: 0.01185424342751503.
[I 2026-05-05 19:29:24,177] Trial 273 pruned. 
[I 2026-05-05 19:29:24,370] Trial 274 pruned. 
[I 2026-05-05 19:30:08,438] Trial 275 pruned. 
[I 2026-05-05 19:32:12,782] Trial 276 pruned. 
[I 2026-05-05 19:35:15,627] Trial 277 finished with value: 0.01297648400068283 and parameters: {'arch': '[]→128', 'normalization': None, 'activation': 'silu', 'lr': 0.008712890420085084, 'weight_decay': 6.507356405454818e-05, 'optimizer': 'adamw', 'use_lookahead': False, 'gradient_clip': 1.0, 'batch_size': 16, 'scheduler_power': 3, 'warmup_steps': 19, 'min_lr_ratio': 0.37705994346900346}. Best is trial 170 with value: 0.01185424342751503.
[I 2026-05-05 19:35:15,829] Trial 278 pruned. 
[I 2026-05-05 19:35:24,087] Trial 279 pruned. 
[I 2026-05-05 19:36:15,433] Trial 280 pruned. 
[I 2026-05-05 19:39:17,995] Trial 281 finished with value: 0.01354760378599167 and parameters: {'arch': '[]→128', 'normalization': None, 'activation': 'silu', 'lr': 0.008048758412923374, 'weight_decay': 2.3119164748136452e-05, 'optimizer': 'adamw', 'use_lookahead': False, 'gradient_clip': 1.0, 'batch_size': 16, 'scheduler_power': 2, 'warmup_steps': 15, 'min_lr_ratio': 0.42308635818276674}. Best is trial 170 with value: 0.01185424342751503.
[I 2026-05-05 19:42:20,515] Trial 282 finished with value: 0.013409819453954697 and parameters: {'arch': '[]→128', 'normalization': None, 'activation': 'silu', 'lr': 0.007918292680411212, 'weight_decay': 0.00011649479240339557, 'optimizer': 'adamw', 'use_lookahead': False, 'gradient_clip': 3.0, 'batch_size': 16, 'scheduler_power': 2, 'warmup_steps': 17, 'min_lr_ratio': 0.4072818753217895}. Best is trial 170 with value: 0.01185424342751503.
[I 2026-05-05 19:42:28,895] Trial 283 pruned. 
[I 2026-05-05 19:45:31,536] Trial 284 finished with value: 0.013621161058545113 and parameters: {'arch': '[]→128', 'normalization': None, 'activation': 'elu', 'lr': 0.006948562414663553, 'weight_decay': 2.3859125766999303e-05, 'optimizer': 'adamw', 'use_lookahead': False, 'gradient_clip': 1.0, 'batch_size': 16, 'scheduler_power': 2, 'warmup_steps': 12, 'min_lr_ratio': 0.4290112822215795}. Best is trial 170 with value: 0.01185424342751503.
[I 2026-05-05 19:48:34,323] Trial 285 finished with value: 0.012497832030057908 and parameters: {'arch': '[]→128', 'normalization': None, 'activation': 'elu', 'lr': 0.009588193715898478, 'weight_decay': 1.200472268167867e-05, 'optimizer': 'adamw', 'use_lookahead': False, 'gradient_clip': 1.0, 'batch_size': 16, 'scheduler_power': 3, 'warmup_steps': 15, 'min_lr_ratio': 0.3606324511198837}. Best is trial 170 with value: 0.01185424342751503.
[I 2026-05-05 19:49:18,315] Trial 286 pruned. 
[I 2026-05-05 19:50:02,399] Trial 287 pruned. 
