[I 2026-04-17 15:24:39,063] Trial 76 finished with value: 0.021850350499153137 and parameters: {'arch': '[16]→64', 'normalization': None, 'activation': 'elu', 'lr': 0.006964892788818806, 'weight_decay': 0.000271315583799313, 'optimizer': 'adam', 'use_lookahead': True, 'gradient_clip': 3.0, 'batch_size': 16, 'scheduler_power': 1, 'warmup_steps': 0, 'min_lr_ratio': 0.16205676520228912}. Best is trial 39 with value: 0.0180429045855999.
[I 2026-04-17 15:25:10,687] Trial 77 finished with value: 0.01557003367692232 and parameters: {'arch': '[64]→128', 'normalization': None, 'activation': 'elu', 'lr': 0.00951505212889796, 'weight_decay': 0.00016388219101609862, 'optimizer': 'adam', 'use_lookahead': True, 'gradient_clip': -1.0, 'batch_size': 16, 'scheduler_power': 1, 'warmup_steps': 4, 'min_lr_ratio': 0.2501007543377237}. Best is trial 77 with value: 0.01557003367692232.
[I 2026-04-17 15:25:46,435] Trial 78 finished with value: 0.019187938943505286 and parameters: {'arch': '[64]→128', 'normalization': None, 'activation': 'elu', 'lr': 0.007098867112517621, 'weight_decay': 0.00012854656968766114, 'optimizer': 'adam', 'use_lookahead': True, 'gradient_clip': 3.0, 'batch_size': 16, 'scheduler_power': 2, 'warmup_steps': 4, 'min_lr_ratio': 0.3500753371075127}. Best is trial 77 with value: 0.01557003367692232.
[I 2026-04-17 15:25:58,074] Trial 79 pruned. 
[I 2026-04-17 15:26:29,651] Trial 80 finished with value: 0.017099178209900857 and parameters: {'arch': '[64]→128', 'normalization': None, 'activation': 'silu', 'lr': 0.007531235364064051, 'weight_decay': 0.00011024100103723103, 'optimizer': 'adam', 'use_lookahead': True, 'gradient_clip': -1.0, 'batch_size': 16, 'scheduler_power': 1, 'warmup_steps': 10, 'min_lr_ratio': 0.32376749743927424}. Best is trial 77 with value: 0.01557003367692232.
[I 2026-04-17 15:26:40,767] Trial 81 pruned. 
[I 2026-04-17 15:27:12,486] Trial 82 finished with value: 0.01810905560851097 and parameters: {'arch': '[16]→32', 'normalization': None, 'activation': 'silu', 'lr': 0.009807679965770989, 'weight_decay': 8.423324693522954e-05, 'optimizer': 'adam', 'use_lookahead': True, 'gradient_clip': -1.0, 'batch_size': 16, 'scheduler_power': 1, 'warmup_steps': 9, 'min_lr_ratio': 0.4349341271479107}. Best is trial 77 with value: 0.01557003367692232.
[I 2026-04-17 15:27:20,612] Trial 83 pruned. 
[I 2026-04-17 15:27:54,418] Trial 84 finished with value: 0.022120766639709473 and parameters: {'arch': '[16]→32', 'normalization': None, 'activation': 'silu', 'lr': 0.008567793208805343, 'weight_decay': 0.00018904012836740025, 'optimizer': 'adam', 'use_lookahead': True, 'gradient_clip': -1.0, 'batch_size': 16, 'scheduler_power': 2, 'warmup_steps': 10, 'min_lr_ratio': 0.336331640415769}. Best is trial 77 with value: 0.01557003367692232.
[I 2026-04-17 15:28:25,766] Trial 85 finished with value: 0.01767523854970932 and parameters: {'arch': '[64]→128', 'normalization': None, 'activation': 'silu', 'lr': 0.008794725323603602, 'weight_decay': 0.0002643749539084323, 'optimizer': 'adam', 'use_lookahead': True, 'gradient_clip': -1.0, 'batch_size': 16, 'scheduler_power': 1, 'warmup_steps': 6, 'min_lr_ratio': 0.2767385714429587}. Best is trial 77 with value: 0.01557003367692232.
[I 2026-04-17 15:28:33,623] Trial 86 pruned. 
[I 2026-04-17 15:28:41,472] Trial 87 pruned. 
[I 2026-04-17 15:29:12,822] Trial 88 finished with value: 0.024170742705464363 and parameters: {'arch': '[64]→128', 'normalization': None, 'activation': 'relu', 'lr': 0.004770135684921847, 'weight_decay': 0.00012056227961873253, 'optimizer': 'adam', 'use_lookahead': True, 'gradient_clip': -1.0, 'batch_size': 16, 'scheduler_power': 2, 'warmup_steps': 3, 'min_lr_ratio': 0.28753715770809}. Best is trial 77 with value: 0.01557003367692232.
[I 2026-04-17 15:29:26,935] Trial 89 pruned. 
[I 2026-04-17 15:29:58,510] Trial 90 finished with value: 0.019054462164640427 and parameters: {'arch': '[16,32]→64', 'normalization': None, 'activation': 'silu', 'lr': 0.009348120219893265, 'weight_decay': 5.933093095280689e-05, 'optimizer': 'adam', 'use_lookahead': False, 'gradient_clip': -1.0, 'batch_size': 16, 'scheduler_power': 1, 'warmup_steps': 3, 'min_lr_ratio': 0.3923305398743973}. Best is trial 77 with value: 0.01557003367692232.
[I 2026-04-17 15:30:30,611] Trial 91 finished with value: 0.016786852329969407 and parameters: {'arch': '[64]→128', 'normalization': None, 'activation': 'elu', 'lr': 0.007731085106463743, 'weight_decay': 4.9558763517736295e-05, 'optimizer': 'adam', 'use_lookahead': True, 'gradient_clip': 3.0, 'batch_size': 16, 'scheduler_power': 3, 'warmup_steps': 5, 'min_lr_ratio': 0.39109515701892583}. Best is trial 77 with value: 0.01557003367692232.
[I 2026-04-17 15:31:06,121] Trial 92 finished with value: 0.022225994393229486 and parameters: {'arch': '[]→32', 'normalization': None, 'activation': 'elu', 'lr': 0.006987415283591505, 'weight_decay': 6.148012777879305e-05, 'optimizer': 'adamw', 'use_lookahead': True, 'gradient_clip': 3.0, 'batch_size': 16, 'scheduler_power': 3, 'warmup_steps': 7, 'min_lr_ratio': 0.35129574614580444}. Best is trial 77 with value: 0.01557003367692232.
[I 2026-04-17 15:31:16,436] Trial 93 pruned. 
[I 2026-04-17 15:31:49,509] Trial 94 pruned. 
[I 2026-04-17 15:31:57,544] Trial 95 pruned. 
[I 2026-04-17 15:32:06,469] Trial 96 pruned. 
[I 2026-04-17 15:32:41,927] Trial 97 finished with value: 0.023392728120088576 and parameters: {'arch': '[16]→32', 'normalization': None, 'activation': 'elu', 'lr': 0.006480257586882432, 'weight_decay': 1.1766662265696072e-05, 'optimizer': 'adam', 'use_lookahead': True, 'gradient_clip': 1.0, 'batch_size': 16, 'scheduler_power': 3, 'warmup_steps': 7, 'min_lr_ratio': 0.42815632878132887}. Best is trial 77 with value: 0.01557003367692232.
[I 2026-04-17 15:32:49,750] Trial 98 pruned. 
[I 2026-04-17 15:33:25,979] Trial 99 finished with value: 0.022179471552371977 and parameters: {'arch': '[64]→128', 'normalization': None, 'activation': 'elu', 'lr': 0.009199577354488718, 'weight_decay': 0.0011297938924810633, 'optimizer': 'adam', 'use_lookahead': True, 'gradient_clip': 3.0, 'batch_size': 16, 'scheduler_power': 3, 'warmup_steps': 0, 'min_lr_ratio': 0.3874283985618776}. Best is trial 77 with value: 0.01557003367692232.
[I 2026-04-17 15:34:01,982] Trial 100 finished with value: 0.019089965894818307 and parameters: {'arch': '[64]→128', 'normalization': None, 'activation': 'silu', 'lr': 0.006162972554240185, 'weight_decay': 1.9198654930340037e-05, 'optimizer': 'adam', 'use_lookahead': True, 'gradient_clip': 1.0, 'batch_size': 16, 'scheduler_power': 1, 'warmup_steps': 4, 'min_lr_ratio': 0.39840216510666676}. Best is trial 77 with value: 0.01557003367692232.
[I 2026-04-17 15:34:38,040] Trial 101 finished with value: 0.014958527348935604 and parameters: {'arch': '[64]→128', 'normalization': None, 'activation': 'silu', 'lr': 0.009222841973790466, 'weight_decay': 1.1087299957162628e-05, 'optimizer': 'adam', 'use_lookahead': True, 'gradient_clip': 5.0, 'batch_size': 16, 'scheduler_power': 1, 'warmup_steps': 6, 'min_lr_ratio': 0.363603007257796}. Best is trial 101 with value: 0.014958527348935604.
[I 2026-04-17 15:35:00,921] Trial 102 pruned. 
[I 2026-04-17 15:35:14,879] Trial 103 pruned. 
[I 2026-04-17 15:35:22,550] Trial 104 pruned. 
[I 2026-04-17 15:35:31,645] Trial 105 pruned. 

============================================================
HPO Complete
============================================================
  Completed trials : 59
  Pruned trials    : 45
  Best trial       : #101
  Best val MSE     : 0.014959

Best hyperparameters:
  arch                  : [64]→128
  normalization         : None
  activation            : silu
  lr                    : 0.009222841973790466
  weight_decay          : 1.1087299957162628e-05
  optimizer             : adam
  use_lookahead         : True
  gradient_clip         : 5.0
  batch_size            : 16
  scheduler_power       : 1
  warmup_steps          : 6
  min_lr_ratio          : 0.363603007257796

Best params saved to: hpo_best_params.yaml
[Fri Apr 17 03:35:32 PM CEST 2026] Job finished
