[Fri Apr 24 11:15:55 AM CEST 2026] Job started on ly-w205
SLURM_JOB_ID=804350
PROJECT_DIR=/globalsc/users/b/a/baffetti/research/TransfomerROM
ENTRYPOINT=CAEst_hpo.py
Activating environment: /globalsc/ulb/atm/baffetti/envs/artfire_new/bin/activate
/globalsc/users/b/a/baffetti/envs/artfire_new/bin/python
/globalsc/users/b/a/baffetti/envs/artfire_new/bin/pip
Python 3.11.3
Fri Apr 24 11:15:55 2026       
+-----------------------------------------------------------------------------------------+
| NVIDIA-SMI 570.124.06             Driver Version: 570.124.06     CUDA Version: 12.8     |
|-----------------------------------------+------------------------+----------------------+
| GPU  Name                 Persistence-M | Bus-Id          Disp.A | Volatile Uncorr. ECC |
| Fan  Temp   Perf          Pwr:Usage/Cap |           Memory-Usage | GPU-Util  Compute M. |
|                                         |                        |               MIG M. |
|=========================================+========================+======================|
|   0  NVIDIA RTX 6000 Ada Gene...    On  |   00000000:01:00.0 Off |                  Off |
| 53%   73C    P0            200W /  300W |       2MiB /  49140MiB |    100%      Default |
|                                         |                        |                  N/A |
+-----------------------------------------+------------------------+----------------------+
                                                                                         
+-----------------------------------------------------------------------------------------+
| Processes:                                                                              |
|  GPU   GI   CI              PID   Type   Process name                        GPU Memory |
|        ID   ID                                                               Usage      |
|=========================================================================================|
|  No running processes found                                                             |
+-----------------------------------------------------------------------------------------+
Python usato:
/globalsc/users/b/a/baffetti/envs/artfire_new/bin/python
/globalsc/users/b/a/baffetti/envs/artfire_new/bin/python
Torch test:
2.5.0+cu124
CUDA available — running on GPU

Loading datasets from: /globalsc/ulb/atm/baffetti/research/Transformer/ArtFire_files/data/D_t2001_f13_z256_x64.npy
Dataset: 1200 train / 400 val samples, C=13, H=256, W=64

HPO config: 100 trials × 25 epochs on cuda

[I 2026-04-24 11:16:34,213] Trial 0 pruned. 
[I 2026-04-24 11:16:34,671] Trial 1 pruned. 
[I 2026-04-24 11:16:34,956] Trial 2 pruned. 
[I 2026-04-24 11:17:17,813] Trial 3 finished with value: 0.03978132829070091 and parameters: {'arch': '[16]→32', 'normalization': 'Group-Norm', 'activation': 'silu', 'lr': 0.008411909465645722, 'weight_decay': 5.69307476764461e-05, 'optimizer': 'adamw', 'use_lookahead': True, 'gradient_clip': -1.0, 'batch_size': 16, 'scheduler_power': 2, 'warmup_steps': 20, 'min_lr_ratio': 0.1286070830406352}. Best is trial 3 with value: 0.03978132829070091.
[I 2026-04-24 11:18:04,244] Trial 4 finished with value: 0.10816537320613862 and parameters: {'arch': '[64]→128', 'normalization': None, 'activation': 'silu', 'lr': 0.00018838307787619773, 'weight_decay': 0.0001054870271491805, 'optimizer': 'adam', 'use_lookahead': True, 'gradient_clip': 1.0, 'batch_size': 64, 'scheduler_power': 3, 'warmup_steps': 13, 'min_lr_ratio': 0.17612459761386334}. Best is trial 3 with value: 0.03978132829070091.
[I 2026-04-24 11:18:43,142] Trial 5 finished with value: 0.03902614071965218 and parameters: {'arch': '[32]→128', 'normalization': 'Instance-Norm', 'activation': 'silu', 'lr': 0.001991892049219753, 'weight_decay': 0.0035291509251299, 'optimizer': 'adamw', 'use_lookahead': False, 'gradient_clip': 3.0, 'batch_size': 16, 'scheduler_power': 2, 'warmup_steps': 12, 'min_lr_ratio': 0.2513336699712433}. Best is trial 5 with value: 0.03902614071965218.
[I 2026-04-24 11:18:44,037] Trial 6 pruned. 
[I 2026-04-24 11:19:23,781] Trial 7 finished with value: 0.07500272184610367 and parameters: {'arch': '[]→16', 'normalization': 'Instance-Norm', 'activation': 'relu', 'lr': 0.0034672655630792193, 'weight_decay': 4.4408191026434416e-05, 'optimizer': 'adamw', 'use_lookahead': False, 'gradient_clip': 5.0, 'batch_size': 64, 'scheduler_power': 1, 'warmup_steps': 9, 'min_lr_ratio': 0.04844362685771032}. Best is trial 5 with value: 0.03902614071965218.
[I 2026-04-24 11:20:03,150] Trial 8 finished with value: 0.1532185447216034 and parameters: {'arch': '[]→32', 'normalization': 'Batch-Norm', 'activation': 'relu', 'lr': 0.00012063063241180603, 'weight_decay': 0.0036845270736218664, 'optimizer': 'adamw', 'use_lookahead': False, 'gradient_clip': -1.0, 'batch_size': 32, 'scheduler_power': 2, 'warmup_steps': 13, 'min_lr_ratio': 0.25653676670424297}. Best is trial 5 with value: 0.03902614071965218.
[I 2026-04-24 11:20:03,352] Trial 9 pruned. 
[I 2026-04-24 11:21:07,136] Trial 10 finished with value: 0.04213457703590393 and parameters: {'arch': '[]→64', 'normalization': 'Instance-Norm', 'activation': 'relu', 'lr': 0.0018433189211875753, 'weight_decay': 0.0014610612282659852, 'optimizer': 'adamw', 'use_lookahead': False, 'gradient_clip': 3.0, 'batch_size': 16, 'scheduler_power': 2, 'warmup_steps': 9, 'min_lr_ratio': 0.13539242072456276}. Best is trial 5 with value: 0.03902614071965218.
[I 2026-04-24 11:22:11,707] Trial 11 finished with value: 0.03816945195198059 and parameters: {'arch': '[]→64', 'normalization': 'Group-Norm', 'activation': 'relu', 'lr': 0.007696314556434379, 'weight_decay': 2.4446847314575368e-05, 'optimizer': 'adamw', 'use_lookahead': True, 'gradient_clip': -1.0, 'batch_size': 16, 'scheduler_power': 2, 'warmup_steps': 18, 'min_lr_ratio': 0.15949251453673452}. Best is trial 11 with value: 0.03816945195198059.
[I 2026-04-24 11:23:16,306] Trial 12 finished with value: 0.038222239911556245 and parameters: {'arch': '[]→64', 'normalization': 'Group-Norm', 'activation': 'relu', 'lr': 0.004825410040814186, 'weight_decay': 1.7410173657216842e-05, 'optimizer': 'adamw', 'use_lookahead': False, 'gradient_clip': 3.0, 'batch_size': 16, 'scheduler_power': 2, 'warmup_steps': 17, 'min_lr_ratio': 0.18292073244344814}. Best is trial 11 with value: 0.03816945195198059.
[I 2026-04-24 11:24:21,763] Trial 13 finished with value: 0.039333575665950776 and parameters: {'arch': '[]→64', 'normalization': 'Group-Norm', 'activation': 'relu', 'lr': 0.002271780486500783, 'weight_decay': 3.7254938456614413e-05, 'optimizer': 'adamw', 'use_lookahead': False, 'gradient_clip': 3.0, 'batch_size': 16, 'scheduler_power': 2, 'warmup_steps': 18, 'min_lr_ratio': 0.2990387348101678}. Best is trial 11 with value: 0.03816945195198059.
[I 2026-04-24 11:24:56,979] Trial 14 finished with value: 0.03850091814994812 and parameters: {'arch': '[32]→128', 'normalization': 'Batch-Norm', 'activation': 'relu', 'lr': 0.004627236887303169, 'weight_decay': 1.7928512473431277e-05, 'optimizer': 'adamw', 'use_lookahead': True, 'gradient_clip': 3.0, 'batch_size': 16, 'scheduler_power': 2, 'warmup_steps': 16, 'min_lr_ratio': 0.014280895129537896}. Best is trial 11 with value: 0.03816945195198059.
[I 2026-04-24 11:25:05,598] Trial 15 pruned. 
[I 2026-04-24 11:25:13,452] Trial 16 pruned. 
[I 2026-04-24 11:25:22,492] Trial 17 pruned. 
[I 2026-04-24 11:25:22,758] Trial 18 pruned. 
[I 2026-04-24 11:25:34,140] Trial 19 pruned. 
[I 2026-04-24 11:28:47,803] Trial 20 finished with value: 0.03842028990387916 and parameters: {'arch': '[]→128', 'normalization': 'Group-Norm', 'activation': 'relu', 'lr': 0.004263623228102056, 'weight_decay': 4.929987756950531e-05, 'optimizer': 'adam', 'use_lookahead': False, 'gradient_clip': 3.0, 'batch_size': 16, 'scheduler_power': 1, 'warmup_steps': 20, 'min_lr_ratio': 0.10075638064702251}. Best is trial 11 with value: 0.03816945195198059.
[I 2026-04-24 11:29:17,947] Trial 21 pruned. 
[I 2026-04-24 11:29:18,189] Trial 22 pruned. 
[I 2026-04-24 11:29:48,680] Trial 23 pruned. 
[I 2026-04-24 11:30:56,296] Trial 24 finished with value: 0.03867567241191864 and parameters: {'arch': '[]→64', 'normalization': 'Group-Norm', 'activation': 'relu', 'lr': 0.004823728948072295, 'weight_decay': 1.3667924713161676e-05, 'optimizer': 'adam', 'use_lookahead': True, 'gradient_clip': 1.0, 'batch_size': 16, 'scheduler_power': 2, 'warmup_steps': 19, 'min_lr_ratio': 0.1505769690742032}. Best is trial 11 with value: 0.03816945195198059.
[I 2026-04-24 11:30:56,506] Trial 25 pruned. 
[I 2026-04-24 11:31:28,562] Trial 26 finished with value: 0.020627812892198564 and parameters: {'arch': '[16]→64', 'normalization': None, 'activation': 'relu', 'lr': 0.00848793680334098, 'weight_decay': 6.058821765975907e-05, 'optimizer': 'adam', 'use_lookahead': False, 'gradient_clip': 3.0, 'batch_size': 16, 'scheduler_power': 2, 'warmup_steps': 16, 'min_lr_ratio': 0.24961451364200382}. Best is trial 26 with value: 0.020627812892198564.
[I 2026-04-24 11:32:00,206] Trial 27 finished with value: 0.023488508835434914 and parameters: {'arch': '[16]→128', 'normalization': None, 'activation': 'silu', 'lr': 0.005066738223100919, 'weight_decay': 1.98205303437425e-05, 'optimizer': 'adam', 'use_lookahead': False, 'gradient_clip': 3.0, 'batch_size': 16, 'scheduler_power': 3, 'warmup_steps': 19, 'min_lr_ratio': 0.26089591446139293}. Best is trial 26 with value: 0.020627812892198564.
[I 2026-04-24 11:32:35,801] Trial 28 finished with value: 0.018329427987337114 and parameters: {'arch': '[]→32', 'normalization': None, 'activation': 'relu', 'lr': 0.007736996507983363, 'weight_decay': 1.8641606457774973e-05, 'optimizer': 'adam', 'use_lookahead': False, 'gradient_clip': -1.0, 'batch_size': 16, 'scheduler_power': 2, 'warmup_steps': 16, 'min_lr_ratio': 0.28157946122026645}. Best is trial 28 with value: 0.018329427987337114.
[I 2026-04-24 11:33:11,254] Trial 29 finished with value: 0.02561893105506897 and parameters: {'arch': '[]→32', 'normalization': None, 'activation': 'silu', 'lr': 0.004958806393543794, 'weight_decay': 2.5418676694981357e-05, 'optimizer': 'adam', 'use_lookahead': False, 'gradient_clip': 3.0, 'batch_size': 16, 'scheduler_power': 3, 'warmup_steps': 17, 'min_lr_ratio': 0.1951274970710426}. Best is trial 28 with value: 0.018329427987337114.
[I 2026-04-24 11:33:25,174] Trial 30 pruned. 
[I 2026-04-24 11:33:25,403] Trial 31 pruned. 
[I 2026-04-24 11:33:33,100] Trial 32 pruned. 
[I 2026-04-24 11:34:09,059] Trial 33 finished with value: 0.019988503977656363 and parameters: {'arch': '[]→32', 'normalization': None, 'activation': 'relu', 'lr': 0.005776553927142663, 'weight_decay': 2.4524080804352776e-05, 'optimizer': 'adam', 'use_lookahead': False, 'gradient_clip': -1.0, 'batch_size': 16, 'scheduler_power': 1, 'warmup_steps': 16, 'min_lr_ratio': 0.2971160336342962}. Best is trial 28 with value: 0.018329427987337114.
[I 2026-04-24 11:34:18,026] Trial 34 pruned. 
[I 2026-04-24 11:34:53,965] Trial 35 finished with value: 0.026721243262290955 and parameters: {'arch': '[]→32', 'normalization': None, 'activation': 'relu', 'lr': 0.0047004373976828355, 'weight_decay': 3.0601464564461e-05, 'optimizer': 'adam', 'use_lookahead': False, 'gradient_clip': -1.0, 'batch_size': 16, 'scheduler_power': 2, 'warmup_steps': 11, 'min_lr_ratio': 0.1660792904668737}. Best is trial 28 with value: 0.018329427987337114.
[I 2026-04-24 11:35:19,854] Trial 36 pruned. 
[I 2026-04-24 11:35:29,758] Trial 37 pruned. 
[I 2026-04-24 11:36:11,416] Trial 38 finished with value: 0.0170791969448328 and parameters: {'arch': '[]→32', 'normalization': None, 'activation': 'silu', 'lr': 0.007833842075009286, 'weight_decay': 7.090695518463709e-05, 'optimizer': 'adamw', 'use_lookahead': False, 'gradient_clip': 5.0, 'batch_size': 16, 'scheduler_power': 1, 'warmup_steps': 13, 'min_lr_ratio': 0.31643489038306566}. Best is trial 38 with value: 0.0170791969448328.
[I 2026-04-24 11:36:42,983] Trial 39 finished with value: 0.023075716495513918 and parameters: {'arch': '[32]→64', 'normalization': None, 'activation': 'relu', 'lr': 0.004952766201387403, 'weight_decay': 0.00022306962447049894, 'optimizer': 'adamw', 'use_lookahead': True, 'gradient_clip': 5.0, 'batch_size': 16, 'scheduler_power': 1, 'warmup_steps': 15, 'min_lr_ratio': 0.3407171551968082}. Best is trial 38 with value: 0.0170791969448328.
[I 2026-04-24 11:36:43,196] Trial 40 pruned. 
[I 2026-04-24 11:36:43,458] Trial 41 pruned. 
[I 2026-04-24 11:36:51,611] Trial 42 pruned. 
[I 2026-04-24 11:37:00,144] Trial 43 pruned. 
[I 2026-04-24 11:37:35,624] Trial 44 finished with value: 0.02052314907312393 and parameters: {'arch': '[]→32', 'normalization': None, 'activation': 'silu', 'lr': 0.006776293013958895, 'weight_decay': 0.0003430578228234777, 'optimizer': 'adamw', 'use_lookahead': False, 'gradient_clip': 3.0, 'batch_size': 16, 'scheduler_power': 2, 'warmup_steps': 8, 'min_lr_ratio': 0.3080875390673482}. Best is trial 38 with value: 0.0170791969448328.
[I 2026-04-24 11:37:44,138] Trial 45 pruned. 
[I 2026-04-24 11:37:53,241] Trial 46 pruned. 
[I 2026-04-24 11:38:28,748] Trial 47 finished with value: 0.023506571501493455 and parameters: {'arch': '[]→32', 'normalization': None, 'activation': 'silu', 'lr': 0.007536715156497461, 'weight_decay': 0.0014703234533015052, 'optimizer': 'adamw', 'use_lookahead': False, 'gradient_clip': 3.0, 'batch_size': 16, 'scheduler_power': 3, 'warmup_steps': 4, 'min_lr_ratio': 0.259526474848185}. Best is trial 38 with value: 0.0170791969448328.
[I 2026-04-24 11:38:38,488] Trial 48 pruned. 
[I 2026-04-24 11:38:38,712] Trial 49 pruned. 
[I 2026-04-24 11:38:46,480] Trial 50 pruned. 
[I 2026-04-24 11:39:17,350] Trial 51 finished with value: 0.019937078878283502 and parameters: {'arch': '[16]→32', 'normalization': None, 'activation': 'gelu', 'lr': 0.008198680859596076, 'weight_decay': 7.4342455287988e-05, 'optimizer': 'adamw', 'use_lookahead': False, 'gradient_clip': 3.0, 'batch_size': 16, 'scheduler_power': 2, 'warmup_steps': 10, 'min_lr_ratio': 0.40063074254345576}. Best is trial 38 with value: 0.0170791969448328.
[I 2026-04-24 11:39:25,172] Trial 52 pruned. 
[I 2026-04-24 11:39:32,875] Trial 53 pruned. 
[I 2026-04-24 11:39:42,032] Trial 54 pruned. 
[I 2026-04-24 11:40:12,857] Trial 55 finished with value: 0.01909784436225891 and parameters: {'arch': '[16]→32', 'normalization': None, 'activation': 'gelu', 'lr': 0.009943901221067107, 'weight_decay': 1.4701736686994271e-05, 'optimizer': 'adamw', 'use_lookahead': False, 'gradient_clip': 1.0, 'batch_size': 16, 'scheduler_power': 1, 'warmup_steps': 3, 'min_lr_ratio': 0.35772453194024995}. Best is trial 38 with value: 0.0170791969448328.
[I 2026-04-24 11:40:13,062] Trial 56 pruned. 
[I 2026-04-24 11:40:50,696] Trial 57 finished with value: 0.03131991595029831 and parameters: {'arch': '[]→32', 'normalization': None, 'activation': 'silu', 'lr': 0.006315731693510689, 'weight_decay': 0.00020115167014465336, 'optimizer': 'adam', 'use_lookahead': False, 'gradient_clip': 3.0, 'batch_size': 32, 'scheduler_power': 2, 'warmup_steps': 7, 'min_lr_ratio': 0.23361795808984542}. Best is trial 38 with value: 0.0170791969448328.
[I 2026-04-24 11:40:50,925] Trial 58 pruned. 
[I 2026-04-24 11:40:59,732] Trial 59 pruned. 
[I 2026-04-24 11:41:09,390] Trial 60 pruned. 
[I 2026-04-24 11:41:48,564] Trial 61 finished with value: 0.02570177525281906 and parameters: {'arch': '[]→32', 'normalization': None, 'activation': 'gelu', 'lr': 0.0036133507631425483, 'weight_decay': 8.707156234603518e-05, 'optimizer': 'adam', 'use_lookahead': False, 'gradient_clip': -1.0, 'batch_size': 16, 'scheduler_power': 1, 'warmup_steps': 16, 'min_lr_ratio': 0.34027392039859133}. Best is trial 38 with value: 0.0170791969448328.
[I 2026-04-24 11:41:57,708] Trial 62 pruned. 
[I 2026-04-24 11:42:05,347] Trial 63 pruned. 
[I 2026-04-24 11:42:41,024] Trial 64 finished with value: 0.02239298604428768 and parameters: {'arch': '[]→32', 'normalization': None, 'activation': 'silu', 'lr': 0.005387846824877981, 'weight_decay': 0.00014224265564713164, 'optimizer': 'adamw', 'use_lookahead': True, 'gradient_clip': 1.0, 'batch_size': 16, 'scheduler_power': 2, 'warmup_steps': 17, 'min_lr_ratio': 0.3278310453564641}. Best is trial 38 with value: 0.0170791969448328.
[I 2026-04-24 11:42:48,906] Trial 65 pruned. 
[I 2026-04-24 11:42:58,356] Trial 66 pruned. 
[I 2026-04-24 11:43:06,510] Trial 67 pruned. 
[I 2026-04-24 11:43:15,143] Trial 68 pruned. 
[I 2026-04-24 11:43:23,312] Trial 69 pruned. 
[I 2026-04-24 11:43:23,511] Trial 70 pruned. 
[I 2026-04-24 11:43:59,089] Trial 71 finished with value: 0.022333648204803467 and parameters: {'arch': '[]→32', 'normalization': None, 'activation': 'silu', 'lr': 0.00507007855542359, 'weight_decay': 0.0004523937162169087, 'optimizer': 'adamw', 'use_lookahead': False, 'gradient_clip': 5.0, 'batch_size': 16, 'scheduler_power': 2, 'warmup_steps': 13, 'min_lr_ratio': 0.28584998143669255}. Best is trial 38 with value: 0.0170791969448328.
[I 2026-04-24 11:44:06,866] Trial 72 pruned. 
[I 2026-04-24 11:44:14,904] Trial 73 pruned. 
[I 2026-04-24 11:44:50,329] Trial 74 finished with value: 0.021894679665565492 and parameters: {'arch': '[]→32', 'normalization': None, 'activation': 'silu', 'lr': 0.006573491610836367, 'weight_decay': 0.0004600403982654438, 'optimizer': 'adamw', 'use_lookahead': False, 'gradient_clip': 5.0, 'batch_size': 16, 'scheduler_power': 1, 'warmup_steps': 5, 'min_lr_ratio': 0.21998135076625824}. Best is trial 38 with value: 0.0170791969448328.
[I 2026-04-24 11:45:25,938] Trial 75 finished with value: 0.016615255028009413 and parameters: {'arch': '[]→32', 'normalization': None, 'activation': 'silu', 'lr': 0.009575930699581986, 'weight_decay': 0.0002824496575669884, 'optimizer': 'adamw', 'use_lookahead': False, 'gradient_clip': -1.0, 'batch_size': 16, 'scheduler_power': 1, 'warmup_steps': 6, 'min_lr_ratio': 0.2438445883445523}. Best is trial 75 with value: 0.016615255028009413.
[I 2026-04-24 11:45:34,557] Trial 76 pruned. 
[I 2026-04-24 11:45:34,767] Trial 77 pruned. 
[I 2026-04-24 11:45:43,536] Trial 78 pruned. 
[I 2026-04-24 11:45:53,429] Trial 79 pruned. 
[I 2026-04-24 11:46:31,653] Trial 80 finished with value: 0.019391274750232695 and parameters: {'arch': '[]→32', 'normalization': None, 'activation': 'relu', 'lr': 0.006205048546458538, 'weight_decay': 1.284920257212579e-05, 'optimizer': 'adam', 'use_lookahead': False, 'gradient_clip': 3.0, 'batch_size': 16, 'scheduler_power': 1, 'warmup_steps': 16, 'min_lr_ratio': 0.3148783342348827}. Best is trial 75 with value: 0.016615255028009413.
[I 2026-04-24 11:46:41,635] Trial 81 pruned. 
[I 2026-04-24 11:46:52,488] Trial 82 pruned. 
[I 2026-04-24 11:47:25,207] Trial 83 finished with value: 0.021435071155428885 and parameters: {'arch': '[16]→128', 'normalization': None, 'activation': 'silu', 'lr': 0.009038337607220313, 'weight_decay': 0.0006617659534768017, 'optimizer': 'adamw', 'use_lookahead': True, 'gradient_clip': -1.0, 'batch_size': 16, 'scheduler_power': 1, 'warmup_steps': 3, 'min_lr_ratio': 0.1986716961648897}. Best is trial 75 with value: 0.016615255028009413.
[I 2026-04-24 11:47:35,419] Trial 84 pruned. 
[I 2026-04-24 11:47:36,108] Trial 85 pruned. 
[I 2026-04-24 11:48:12,491] Trial 86 finished with value: 0.019179971739649773 and parameters: {'arch': '[32]→64', 'normalization': None, 'activation': 'relu', 'lr': 0.006534947690747248, 'weight_decay': 2.9491106071007124e-05, 'optimizer': 'adam', 'use_lookahead': False, 'gradient_clip': -1.0, 'batch_size': 16, 'scheduler_power': 1, 'warmup_steps': 14, 'min_lr_ratio': 0.3615378958096761}. Best is trial 75 with value: 0.016615255028009413.
[I 2026-04-24 11:48:21,405] Trial 87 pruned. 
[I 2026-04-24 11:48:21,609] Trial 88 pruned. 
[I 2026-04-24 11:48:30,457] Trial 89 pruned. 
[I 2026-04-24 11:49:02,183] Trial 90 finished with value: 0.017857069075107576 and parameters: {'arch': '[32]→64', 'normalization': None, 'activation': 'relu', 'lr': 0.008957819167245034, 'weight_decay': 0.00028172671517037913, 'optimizer': 'adam', 'use_lookahead': False, 'gradient_clip': -1.0, 'batch_size': 16, 'scheduler_power': 1, 'warmup_steps': 16, 'min_lr_ratio': 0.40285740538149545}. Best is trial 75 with value: 0.016615255028009413.
[I 2026-04-24 11:49:33,693] Trial 91 finished with value: 0.017572965249419214 and parameters: {'arch': '[32]→64', 'normalization': None, 'activation': 'relu', 'lr': 0.00726452396594077, 'weight_decay': 3.914146207994648e-05, 'optimizer': 'adam', 'use_lookahead': False, 'gradient_clip': -1.0, 'batch_size': 16, 'scheduler_power': 1, 'warmup_steps': 16, 'min_lr_ratio': 0.3414389044124455}. Best is trial 75 with value: 0.016615255028009413.
[I 2026-04-24 11:49:41,922] Trial 92 pruned. 
[I 2026-04-24 11:49:49,782] Trial 93 pruned. 
[I 2026-04-24 11:50:00,021] Trial 94 pruned. 
[I 2026-04-24 11:50:09,680] Trial 95 pruned. 
[I 2026-04-24 11:50:22,200] Trial 96 pruned. 
[I 2026-04-24 11:50:57,918] Trial 97 finished with value: 0.01898933932185173 and parameters: {'arch': '[32]→64', 'normalization': None, 'activation': 'relu', 'lr': 0.006752374312348999, 'weight_decay': 1.822527330921466e-05, 'optimizer': 'adam', 'use_lookahead': False, 'gradient_clip': -1.0, 'batch_size': 16, 'scheduler_power': 1, 'warmup_steps': 9, 'min_lr_ratio': 0.3328945878171968}. Best is trial 75 with value: 0.016615255028009413.
[I 2026-04-24 11:51:29,568] Trial 98 finished with value: 0.022992643490433694 and parameters: {'arch': '[32]→64', 'normalization': None, 'activation': 'elu', 'lr': 0.003936723759831041, 'weight_decay': 0.00011362564434367226, 'optimizer': 'adam', 'use_lookahead': False, 'gradient_clip': -1.0, 'batch_size': 16, 'scheduler_power': 1, 'warmup_steps': 12, 'min_lr_ratio': 0.4511919406693605}. Best is trial 75 with value: 0.016615255028009413.
