[I 2026-04-24 11:51:37,326] Trial 99 pruned. 

============================================================
HPO Complete
============================================================
  Completed trials : 37
  Pruned trials    : 63
  Best trial       : #75
  Best val MSE     : 0.016615

Best hyperparameters:
  arch                  : []→32
  normalization         : None
  activation            : silu
  lr                    : 0.009575930699581986
  weight_decay          : 0.0002824496575669884
  optimizer             : adamw
  use_lookahead         : False
  gradient_clip         : -1.0
  batch_size            : 16
  scheduler_power       : 1
  warmup_steps          : 6
  min_lr_ratio          : 0.2438445883445523

Best params saved to: caest_hpo_best_params.yaml
[Fri Apr 24 11:51:38 AM CEST 2026] Job finished
