[Tue May  5 03:36:37 PM CEST 2026] Job started on ly-w115
SLURM_JOB_ID=851577
PROJECT_DIR=/globalsc/users/b/a/baffetti/research/TransfomerROM
ENTRYPOINT=CAEst_hpo.py
Activating environment: /globalsc/ulb/atm/baffetti/envs/artfire_new/bin/activate
/globalsc/users/b/a/baffetti/envs/artfire_new/bin/python
/globalsc/users/b/a/baffetti/envs/artfire_new/bin/pip
Python 3.11.3
Tue May  5 15:36:37 2026       
+-----------------------------------------------------------------------------------------+
| NVIDIA-SMI 570.124.06             Driver Version: 570.124.06     CUDA Version: 12.8     |
|-----------------------------------------+------------------------+----------------------+
| GPU  Name                 Persistence-M | Bus-Id          Disp.A | Volatile Uncorr. ECC |
| Fan  Temp   Perf          Pwr:Usage/Cap |           Memory-Usage | GPU-Util  Compute M. |
|                                         |                        |               MIG M. |
|=========================================+========================+======================|
|   0  NVIDIA RTX 6000 Ada Gene...    On  |   00000000:01:00.0 Off |                  Off |
| 33%   57C    P5             45W /  300W |       2MiB /  49140MiB |      0%      Default |
|                                         |                        |                  N/A |
+-----------------------------------------+------------------------+----------------------+
                                                                                         
+-----------------------------------------------------------------------------------------+
| Processes:                                                                              |
|  GPU   GI   CI              PID   Type   Process name                        GPU Memory |
|        ID   ID                                                               Usage      |
|=========================================================================================|
|  No running processes found                                                             |
+-----------------------------------------------------------------------------------------+
Python usato:
/globalsc/users/b/a/baffetti/envs/artfire_new/bin/python
/globalsc/users/b/a/baffetti/envs/artfire_new/bin/python
Torch test:
2.5.0+cu124
CUDA available — running on GPU

Loading datasets from: /globalsc/ulb/atm/baffetti/research/Transformer/ArtFire_files/data/D_t2001_f13_z256_x64.npy
Dataset: 1200 train / 400 val samples, C=13, H=256, W=64

HPO config: 100 trials × 25 epochs on cuda

[I 2026-05-05 15:37:47,510] Trial 100 pruned. 
[I 2026-05-05 15:37:56,041] Trial 101 pruned. 
[I 2026-05-05 15:37:56,406] Trial 102 pruned. 
[I 2026-05-05 15:38:31,842] Trial 103 finished with value: 0.015773798637092114 and parameters: {'arch': '[]→32', 'normalization': None, 'activation': 'silu', 'lr': 0.008291387668191602, 'weight_decay': 3.206251834435475e-05, 'optimizer': 'adam', 'use_lookahead': False, 'gradient_clip': 5.0, 'batch_size': 16, 'scheduler_power': 1, 'warmup_steps': 11, 'min_lr_ratio': 0.3916318358072827}. Best is trial 103 with value: 0.015773798637092114.
[I 2026-05-05 15:38:41,011] Trial 104 pruned. 
[I 2026-05-05 15:38:48,433] Trial 105 pruned. 
[I 2026-05-05 15:39:23,145] Trial 106 finished with value: 0.015981428697705267 and parameters: {'arch': '[]→32', 'normalization': None, 'activation': 'silu', 'lr': 0.008643407066049715, 'weight_decay': 2.6434232937270504e-05, 'optimizer': 'adam', 'use_lookahead': False, 'gradient_clip': 5.0, 'batch_size': 16, 'scheduler_power': 1, 'warmup_steps': 14, 'min_lr_ratio': 0.4068250364823291}. Best is trial 103 with value: 0.015773798637092114.
[I 2026-05-05 15:39:23,332] Trial 107 pruned. 
[I 2026-05-05 15:39:31,874] Trial 108 pruned. 
[I 2026-05-05 15:40:07,613] Trial 109 finished with value: 0.020928055942058564 and parameters: {'arch': '[]→32', 'normalization': None, 'activation': 'elu', 'lr': 0.004774297512921643, 'weight_decay': 1.03319476519305e-05, 'optimizer': 'adam', 'use_lookahead': False, 'gradient_clip': 3.0, 'batch_size': 16, 'scheduler_power': 2, 'warmup_steps': 18, 'min_lr_ratio': 0.3261471766099793}. Best is trial 103 with value: 0.015773798637092114.
[I 2026-05-05 15:40:15,716] Trial 110 pruned. 
[I 2026-05-05 15:40:15,915] Trial 111 pruned. 
[I 2026-05-05 15:40:50,572] Trial 112 finished with value: 0.015127867422997952 and parameters: {'arch': '[]→32', 'normalization': None, 'activation': 'silu', 'lr': 0.008224181167419768, 'weight_decay': 4.82203510999743e-05, 'optimizer': 'adam', 'use_lookahead': False, 'gradient_clip': 1.0, 'batch_size': 16, 'scheduler_power': 1, 'warmup_steps': 14, 'min_lr_ratio': 0.46697502013749664}. Best is trial 112 with value: 0.015127867422997952.
[I 2026-05-05 15:41:28,026] Trial 113 finished with value: 0.014866756536066532 and parameters: {'arch': '[]→32', 'normalization': None, 'activation': 'silu', 'lr': 0.008694557611080957, 'weight_decay': 7.854235752149556e-05, 'optimizer': 'adam', 'use_lookahead': False, 'gradient_clip': 1.0, 'batch_size': 16, 'scheduler_power': 1, 'warmup_steps': 15, 'min_lr_ratio': 0.4432601303323571}. Best is trial 113 with value: 0.014866756536066532.
[I 2026-05-05 15:41:47,873] Trial 114 pruned. 
[I 2026-05-05 15:41:48,074] Trial 115 pruned. 
[I 2026-05-05 15:41:57,023] Trial 116 pruned. 
[I 2026-05-05 15:42:05,049] Trial 117 pruned. 
[I 2026-05-05 15:42:12,907] Trial 118 pruned. 
[I 2026-05-05 15:42:43,653] Trial 119 finished with value: 0.02052133299410343 and parameters: {'arch': '[32]→128', 'normalization': None, 'activation': 'silu', 'lr': 0.004428730536390818, 'weight_decay': 8.461909418274766e-05, 'optimizer': 'adam', 'use_lookahead': False, 'gradient_clip': 1.0, 'batch_size': 16, 'scheduler_power': 1, 'warmup_steps': 13, 'min_lr_ratio': 0.4275733596774693}. Best is trial 113 with value: 0.014866756536066532.
[I 2026-05-05 15:42:43,933] Trial 120 pruned. 
[I 2026-05-05 15:42:52,142] Trial 121 pruned. 
[I 2026-05-05 15:43:26,535] Trial 122 finished with value: 0.017844621166586874 and parameters: {'arch': '[16]→32', 'normalization': None, 'activation': 'elu', 'lr': 0.009154432261325549, 'weight_decay': 6.174255367035332e-05, 'optimizer': 'adamw', 'use_lookahead': False, 'gradient_clip': 1.0, 'batch_size': 16, 'scheduler_power': 1, 'warmup_steps': 3, 'min_lr_ratio': 0.34992986678603577}. Best is trial 113 with value: 0.014866756536066532.
[I 2026-05-05 15:43:34,963] Trial 123 pruned. 
[I 2026-05-05 15:44:12,343] Trial 124 finished with value: 0.01683898352086544 and parameters: {'arch': '[]→32', 'normalization': None, 'activation': 'silu', 'lr': 0.008329478456995948, 'weight_decay': 8.080215962749868e-05, 'optimizer': 'adam', 'use_lookahead': False, 'gradient_clip': 3.0, 'batch_size': 16, 'scheduler_power': 1, 'warmup_steps': 10, 'min_lr_ratio': 0.40795520324571666}. Best is trial 113 with value: 0.014866756536066532.
[I 2026-05-05 15:44:23,046] Trial 125 pruned. 
[I 2026-05-05 15:44:32,676] Trial 126 pruned. 
[I 2026-05-05 15:45:10,331] Trial 127 finished with value: 0.019498481526970864 and parameters: {'arch': '[]→32', 'normalization': None, 'activation': 'silu', 'lr': 0.006260029570822036, 'weight_decay': 0.0001876590297484548, 'optimizer': 'adam', 'use_lookahead': False, 'gradient_clip': 3.0, 'batch_size': 16, 'scheduler_power': 1, 'warmup_steps': 11, 'min_lr_ratio': 0.3330695966613397}. Best is trial 113 with value: 0.014866756536066532.
[I 2026-05-05 15:45:10,530] Trial 128 pruned. 
[I 2026-05-05 15:45:10,734] Trial 129 pruned. 
[I 2026-05-05 15:45:10,931] Trial 130 pruned. 
[I 2026-05-05 15:46:11,779] Trial 131 finished with value: 0.018550749197602273 and parameters: {'arch': '[]→64', 'normalization': None, 'activation': 'silu', 'lr': 0.006460063634428463, 'weight_decay': 0.00029947492219272755, 'optimizer': 'adam', 'use_lookahead': True, 'gradient_clip': -1.0, 'batch_size': 16, 'scheduler_power': 1, 'warmup_steps': 19, 'min_lr_ratio': 0.4039388564442013}. Best is trial 113 with value: 0.014866756536066532.
[I 2026-05-05 15:46:11,964] Trial 132 pruned. 
[I 2026-05-05 15:46:29,209] Trial 133 pruned. 
[I 2026-05-05 15:46:36,792] Trial 134 pruned. 
[I 2026-05-05 15:46:44,397] Trial 135 pruned. 
[I 2026-05-05 15:46:52,072] Trial 136 pruned. 
[I 2026-05-05 15:47:19,191] Trial 137 pruned. 
[I 2026-05-05 15:47:34,829] Trial 138 pruned. 
[I 2026-05-05 15:47:50,595] Trial 139 pruned. 
[I 2026-05-05 15:48:21,452] Trial 140 finished with value: 0.019238577485084535 and parameters: {'arch': '[16]→128', 'normalization': None, 'activation': 'elu', 'lr': 0.007626506088975567, 'weight_decay': 0.00034476173416276223, 'optimizer': 'adamw', 'use_lookahead': True, 'gradient_clip': 1.0, 'batch_size': 16, 'scheduler_power': 1, 'warmup_steps': 0, 'min_lr_ratio': 0.4346170282118558}. Best is trial 113 with value: 0.014866756536066532.
[I 2026-05-05 15:48:58,927] Trial 141 finished with value: 0.013528168760240078 and parameters: {'arch': '[]→32', 'normalization': None, 'activation': 'relu', 'lr': 0.009265505294969027, 'weight_decay': 2.140282530172107e-05, 'optimizer': 'adam', 'use_lookahead': False, 'gradient_clip': -1.0, 'batch_size': 16, 'scheduler_power': 3, 'warmup_steps': 16, 'min_lr_ratio': 0.44119620711752044}. Best is trial 141 with value: 0.013528168760240078.
[I 2026-05-05 15:49:08,199] Trial 142 pruned. 
[I 2026-05-05 15:49:45,682] Trial 143 finished with value: 0.01801605761051178 and parameters: {'arch': '[]→32', 'normalization': None, 'activation': 'silu', 'lr': 0.008252452111159825, 'weight_decay': 4.470192163162245e-05, 'optimizer': 'adamw', 'use_lookahead': True, 'gradient_clip': 5.0, 'batch_size': 16, 'scheduler_power': 1, 'warmup_steps': 14, 'min_lr_ratio': 0.3621477538276764}. Best is trial 141 with value: 0.013528168760240078.
[I 2026-05-05 15:50:23,217] Trial 144 finished with value: 0.016838966086506844 and parameters: {'arch': '[]→32', 'normalization': None, 'activation': 'silu', 'lr': 0.008946915636544633, 'weight_decay': 1.0424458547893282e-05, 'optimizer': 'adam', 'use_lookahead': True, 'gradient_clip': -1.0, 'batch_size': 16, 'scheduler_power': 3, 'warmup_steps': 15, 'min_lr_ratio': 0.44919162509936533}. Best is trial 141 with value: 0.013528168760240078.
[I 2026-05-05 15:51:00,792] Trial 145 finished with value: 0.01877071551978588 and parameters: {'arch': '[]→32', 'normalization': None, 'activation': 'silu', 'lr': 0.008097644683710888, 'weight_decay': 2.598986682553309e-05, 'optimizer': 'adam', 'use_lookahead': True, 'gradient_clip': -1.0, 'batch_size': 16, 'scheduler_power': 3, 'warmup_steps': 16, 'min_lr_ratio': 0.45603816618170717}. Best is trial 141 with value: 0.013528168760240078.
[I 2026-05-05 15:51:00,988] Trial 146 pruned. 
[I 2026-05-05 15:51:09,895] Trial 147 pruned. 
[I 2026-05-05 15:51:17,569] Trial 148 pruned. 
[I 2026-05-05 15:51:31,822] Trial 149 pruned. 
[I 2026-05-05 15:51:39,521] Trial 150 pruned. 
[I 2026-05-05 15:51:48,293] Trial 151 pruned. 
[I 2026-05-05 15:54:49,546] Trial 152 finished with value: 0.016979784816503526 and parameters: {'arch': '[]→128', 'normalization': None, 'activation': 'silu', 'lr': 0.006167326601607781, 'weight_decay': 4.902663379782116e-05, 'optimizer': 'adam', 'use_lookahead': True, 'gradient_clip': 3.0, 'batch_size': 16, 'scheduler_power': 3, 'warmup_steps': 17, 'min_lr_ratio': 0.4667877330859141}. Best is trial 141 with value: 0.013528168760240078.
[I 2026-05-05 15:55:24,567] Trial 153 finished with value: 0.019535674527287484 and parameters: {'arch': '[]→32', 'normalization': None, 'activation': 'silu', 'lr': 0.005945738756177677, 'weight_decay': 0.00025499989797063275, 'optimizer': 'adam', 'use_lookahead': False, 'gradient_clip': 1.0, 'batch_size': 16, 'scheduler_power': 1, 'warmup_steps': 10, 'min_lr_ratio': 0.4854550701911973}. Best is trial 141 with value: 0.013528168760240078.
[I 2026-05-05 15:55:24,775] Trial 154 pruned. 
[I 2026-05-05 15:56:44,731] Trial 155 pruned. 
[I 2026-05-05 15:59:46,181] Trial 156 finished with value: 0.01714774414896965 and parameters: {'arch': '[]→128', 'normalization': None, 'activation': 'silu', 'lr': 0.005419798814136311, 'weight_decay': 1.5212834287967244e-05, 'optimizer': 'adamw', 'use_lookahead': True, 'gradient_clip': 3.0, 'batch_size': 16, 'scheduler_power': 2, 'warmup_steps': 18, 'min_lr_ratio': 0.4829493473689071}. Best is trial 141 with value: 0.013528168760240078.
[I 2026-05-05 15:59:53,949] Trial 157 pruned. 
[I 2026-05-05 16:00:37,717] Trial 158 pruned. 
[I 2026-05-05 16:00:45,684] Trial 159 pruned. 
[I 2026-05-05 16:00:53,367] Trial 160 pruned. 
[I 2026-05-05 16:03:54,948] Trial 161 finished with value: 0.013527731224894524 and parameters: {'arch': '[]→128', 'normalization': None, 'activation': 'elu', 'lr': 0.009918701586417401, 'weight_decay': 3.604326329198563e-05, 'optimizer': 'adamw', 'use_lookahead': False, 'gradient_clip': 3.0, 'batch_size': 16, 'scheduler_power': 2, 'warmup_steps': 20, 'min_lr_ratio': 0.472016407591738}. Best is trial 161 with value: 0.013527731224894524.
[I 2026-05-05 16:04:41,764] Trial 162 pruned. 
[I 2026-05-05 16:06:23,584] Trial 163 pruned. 
[I 2026-05-05 16:07:07,369] Trial 164 pruned. 
[I 2026-05-05 16:09:17,999] Trial 165 pruned. 
[I 2026-05-05 16:09:54,935] Trial 166 finished with value: 0.014032016061246395 and parameters: {'arch': '[64]→128', 'normalization': None, 'activation': 'silu', 'lr': 0.008666358875967083, 'weight_decay': 1.4989672805521102e-05, 'optimizer': 'adam', 'use_lookahead': False, 'gradient_clip': 5.0, 'batch_size': 16, 'scheduler_power': 1, 'warmup_steps': 14, 'min_lr_ratio': 0.3944810675036587}. Best is trial 161 with value: 0.013527731224894524.
[I 2026-05-05 16:10:32,079] Trial 167 finished with value: 0.01468599122017622 and parameters: {'arch': '[64]→128', 'normalization': None, 'activation': 'silu', 'lr': 0.006689591621614008, 'weight_decay': 1.3864455424317532e-05, 'optimizer': 'adam', 'use_lookahead': False, 'gradient_clip': 5.0, 'batch_size': 16, 'scheduler_power': 1, 'warmup_steps': 12, 'min_lr_ratio': 0.48916183479874586}. Best is trial 161 with value: 0.013527731224894524.
[I 2026-05-05 16:10:42,654] Trial 168 pruned. 
[I 2026-05-05 16:11:08,239] Trial 169 pruned. 
[I 2026-05-05 16:14:09,656] Trial 170 finished with value: 0.01185424342751503 and parameters: {'arch': '[]→128', 'normalization': None, 'activation': 'silu', 'lr': 0.009862490280798981, 'weight_decay': 3.386540833241391e-05, 'optimizer': 'adamw', 'use_lookahead': False, 'gradient_clip': 1.0, 'batch_size': 16, 'scheduler_power': 2, 'warmup_steps': 17, 'min_lr_ratio': 0.4892233276394659}. Best is trial 170 with value: 0.01185424342751503.
[I 2026-05-05 16:14:17,175] Trial 171 pruned. 
[I 2026-05-05 16:17:18,734] Trial 172 finished with value: 0.01394011192023754 and parameters: {'arch': '[]→128', 'normalization': None, 'activation': 'silu', 'lr': 0.007216018701441773, 'weight_decay': 0.00012912185096684555, 'optimizer': 'adamw', 'use_lookahead': False, 'gradient_clip': 1.0, 'batch_size': 16, 'scheduler_power': 2, 'warmup_steps': 18, 'min_lr_ratio': 0.46985054245643715}. Best is trial 170 with value: 0.01185424342751503.
[I 2026-05-05 16:18:03,587] Trial 173 pruned. 
[I 2026-05-05 16:18:38,618] Trial 174 finished with value: 0.013865924850106239 and parameters: {'arch': '[]→32', 'normalization': None, 'activation': 'silu', 'lr': 0.009654989293490533, 'weight_decay': 1.6099156776885876e-05, 'optimizer': 'adam', 'use_lookahead': False, 'gradient_clip': 5.0, 'batch_size': 16, 'scheduler_power': 1, 'warmup_steps': 14, 'min_lr_ratio': 0.4225151898415031}. Best is trial 170 with value: 0.01185424342751503.
[I 2026-05-05 16:21:40,091] Trial 175 finished with value: 0.013203714638948441 and parameters: {'arch': '[]→128', 'normalization': None, 'activation': 'silu', 'lr': 0.009204876526122329, 'weight_decay': 0.0006368845946891125, 'optimizer': 'adamw', 'use_lookahead': False, 'gradient_clip': 1.0, 'batch_size': 16, 'scheduler_power': 3, 'warmup_steps': 16, 'min_lr_ratio': 0.3870703953624364}. Best is trial 170 with value: 0.01185424342751503.
[I 2026-05-05 16:24:41,688] Trial 176 finished with value: 0.01898307926952839 and parameters: {'arch': '[]→128', 'normalization': None, 'activation': 'gelu', 'lr': 0.0050159601862028134, 'weight_decay': 0.0002958224879894083, 'optimizer': 'adamw', 'use_lookahead': False, 'gradient_clip': 1.0, 'batch_size': 16, 'scheduler_power': 3, 'warmup_steps': 12, 'min_lr_ratio': 0.38832705482591884}. Best is trial 170 with value: 0.01185424342751503.
[I 2026-05-05 16:25:15,474] Trial 177 finished with value: 0.015715448707342147 and parameters: {'arch': '[64]→128', 'normalization': None, 'activation': 'gelu', 'lr': 0.007027779474636769, 'weight_decay': 2.162656302745772e-05, 'optimizer': 'adam', 'use_lookahead': False, 'gradient_clip': 5.0, 'batch_size': 16, 'scheduler_power': 1, 'warmup_steps': 17, 'min_lr_ratio': 0.48549714657403875}. Best is trial 170 with value: 0.01185424342751503.
[I 2026-05-05 16:25:23,663] Trial 178 pruned. 
[I 2026-05-05 16:25:31,374] Trial 179 pruned. 
[I 2026-05-05 16:28:32,666] Trial 180 finished with value: 0.012273454703390599 and parameters: {'arch': '[]→128', 'normalization': None, 'activation': 'silu', 'lr': 0.009292254322897995, 'weight_decay': 0.004472009409909083, 'optimizer': 'adamw', 'use_lookahead': False, 'gradient_clip': 1.0, 'batch_size': 16, 'scheduler_power': 3, 'warmup_steps': 18, 'min_lr_ratio': 0.4215088713733504}. Best is trial 170 with value: 0.01185424342751503.
[I 2026-05-05 16:28:41,463] Trial 181 pruned. 
[I 2026-05-05 16:31:42,781] Trial 182 finished with value: 0.016647068187594413 and parameters: {'arch': '[]→128', 'normalization': None, 'activation': 'silu', 'lr': 0.005155240494931161, 'weight_decay': 0.00647972497279403, 'optimizer': 'adamw', 'use_lookahead': False, 'gradient_clip': 1.0, 'batch_size': 16, 'scheduler_power': 3, 'warmup_steps': 15, 'min_lr_ratio': 0.4038110182885922}. Best is trial 170 with value: 0.01185424342751503.
[I 2026-05-05 16:33:02,788] Trial 183 pruned. 
[I 2026-05-05 16:33:10,987] Trial 184 pruned. 
[I 2026-05-05 16:33:11,184] Trial 185 pruned. 
[I 2026-05-05 16:36:12,631] Trial 186 finished with value: 0.01324775282293558 and parameters: {'arch': '[]→128', 'normalization': None, 'activation': 'silu', 'lr': 0.0072366677488647875, 'weight_decay': 3.576539504594931e-05, 'optimizer': 'adamw', 'use_lookahead': False, 'gradient_clip': 1.0, 'batch_size': 16, 'scheduler_power': 2, 'warmup_steps': 20, 'min_lr_ratio': 0.4408701747465532}. Best is trial 170 with value: 0.01185424342751503.
[I 2026-05-05 16:36:20,940] Trial 187 pruned. 
[I 2026-05-05 16:39:22,132] Trial 188 finished with value: 0.019322929978370665 and parameters: {'arch': '[]→128', 'normalization': None, 'activation': 'silu', 'lr': 0.004134128348913727, 'weight_decay': 0.0002626781211838213, 'optimizer': 'adamw', 'use_lookahead': False, 'gradient_clip': -1.0, 'batch_size': 16, 'scheduler_power': 2, 'warmup_steps': 12, 'min_lr_ratio': 0.442280118497432}. Best is trial 170 with value: 0.01185424342751503.
[I 2026-05-05 16:40:05,847] Trial 189 pruned. 
[I 2026-05-05 16:40:40,910] Trial 190 finished with value: 0.014699016250669956 and parameters: {'arch': '[]→32', 'normalization': None, 'activation': 'silu', 'lr': 0.009536516404742384, 'weight_decay': 2.5243384483213e-05, 'optimizer': 'adam', 'use_lookahead': False, 'gradient_clip': 5.0, 'batch_size': 16, 'scheduler_power': 1, 'warmup_steps': 11, 'min_lr_ratio': 0.4460568291678354}. Best is trial 170 with value: 0.01185424342751503.
[I 2026-05-05 16:40:49,226] Trial 191 pruned. 
[I 2026-05-05 16:40:49,419] Trial 192 pruned. 
[I 2026-05-05 16:40:58,579] Trial 193 pruned. 
[I 2026-05-05 16:41:07,719] Trial 194 pruned. 
[I 2026-05-05 16:41:07,942] Trial 195 pruned. 
[I 2026-05-05 16:41:08,151] Trial 196 pruned. 
[I 2026-05-05 16:44:09,460] Trial 197 finished with value: 0.0127845024690032 and parameters: {'arch': '[]→128', 'normalization': None, 'activation': 'silu', 'lr': 0.009341010523394595, 'weight_decay': 0.005951588262831887, 'optimizer': 'adamw', 'use_lookahead': False, 'gradient_clip': 1.0, 'batch_size': 16, 'scheduler_power': 3, 'warmup_steps': 10, 'min_lr_ratio': 0.4883212486061715}. Best is trial 170 with value: 0.01185424342751503.
[I 2026-05-05 16:45:29,385] Trial 198 pruned. 
[I 2026-05-05 16:46:07,269] Trial 199 finished with value: 0.016920314654707908 and parameters: {'arch': '[]→32', 'normalization': None, 'activation': 'silu', 'lr': 0.008516901243601292, 'weight_decay': 2.0885507560245407e-05, 'optimizer': 'adam', 'use_lookahead': False, 'gradient_clip': 5.0, 'batch_size': 16, 'scheduler_power': 2, 'warmup_steps': 8, 'min_lr_ratio': 0.4066287699698848}. Best is trial 170 with value: 0.01185424342751503.

============================================================
HPO Complete
============================================================
  Completed trials : 71
  Pruned trials    : 129
  Best trial       : #170
  Best val MSE     : 0.011854

Best hyperparameters:
  arch                  : []→128
  normalization         : None
  activation            : silu
  lr                    : 0.009862490280798981
  weight_decay          : 3.386540833241391e-05
  optimizer             : adamw
  use_lookahead         : False
  gradient_clip         : 1.0
  batch_size            : 16
  scheduler_power       : 2
  warmup_steps          : 17
  min_lr_ratio          : 0.4892233276394659

Best params saved to: caest_hpo_best_params.yaml
[Tue May  5 04:46:08 PM CEST 2026] Job finished
